backers_count,blurb,category,country_displayable_name,creator,goal,location,name,pledged,slug,spotlight,staff_pick,state,urls,usd_pledged,preview_time,fundraising_time,state_change
61,after 6 years and 12672 classes  infinity dance arts has unexpectedly lost its space  we need your help to build our new home,Dance,the United States,Jennifer Solomon,10000,"El Cajon, CA",Infinity Dance Arts- The BIG Move,31230.0,infinity dance arts the big move,True,True,successful,https://www.kickstarter.com/projects/1818465505/infinity-dance-arts-the-big-move?ref=discovery_category_newest,31230.0,13,33,33
3,kid kushy is a comfy colorful cushion for kids booster seats offered in 10 kidfriendly designs comfy kids are happy kids,DIY,the United States,Bill Genovich,5000,"Grand Rapids, MI",Kid Kushy - A Comfy Cushion for Kids' Booster Seats,31.0,kid kushy a comfy cushion for kids booster seats,False,False,failed,https://www.kickstarter.com/projects/124349542/kid-kushy-a-comfy-cushion-for-kids-booster-seats?ref=discovery_category_newest,31.0,1,30,30
141,an exploration of gender dysphoria euphoria societys expectations and how cool it would be to turn into a giant green monster,Graphic Novels,the United States,Daniel Escargot,800,"Austin, TX",The Skirt,2511.9,the skirt,False,True,live,https://www.kickstarter.com/projects/1417894594/the-skirt?ref=discovery_category_newest,2511.9,43,30,0
12,turning wood pens pencils and other items to be individualized great as gifts,Woodworking,the United States,Evanescent Ink Solutions LLC,5000,"Herkimer, NY",Veteran Small Business Startup,430.0,veteran small business startup,False,False,failed,https://www.kickstarter.com/projects/woodturning1966/veteran-small-business-startup?ref=discovery_category_newest,430.0,21,30,30
23,cosmically cute enamel pins brought to you by sugar lagoon,Crafts,the United States,Sami Denny,400,"Tampa, FL",Sugar Lagoon: Space Cat Enamel Pins,428.0,sugar lagoon enamel pins,True,False,successful,https://www.kickstarter.com/projects/sugarlagoon/sugar-lagoon-enamel-pins?ref=discovery_category_newest,428.0,18,7,7
378,organic glutenfree and vegan the skincare solution for anyone who wouldnt put anything on their skin they wouldnt trust eating,DIY,the United States,Drifter Organics,7000,"San Francisco, CA","The Best Natural Skincare for a Mindful, Modern Life",11048.0,the best natural skincare for a mindful modern lif,True,False,successful,https://www.kickstarter.com/projects/drifterorganics/the-best-natural-skincare-for-a-mindful-modern-lif?ref=discovery_category_newest,11048.0,41,30,30
24,a beautiful popup card a month for the duration of 2021,Stationery,the United States,Elizabeth Lindeman,100,"Minneapolis, MN",Popup Card Subscription for 2021- Make 100,1050.0,popup card subscription for 2021 make 100,True,False,successful,https://www.kickstarter.com/projects/elizakpopups/popup-card-subscription-for-2021-make-100?ref=discovery_category_newest,1050.0,0,30,30
14,breakthrough bath bombs natural and biodegradable bath bombs that satisfy skin and make each bath become a haven,DIY,the United States,Emilee Arkose,500,"Chico, CA","Pregnant, now Unemployed. In need of a breakthrough.",784.0,breakthrough may your bath be your next breakthrou,True,False,successful,https://www.kickstarter.com/projects/emmarealist/breakthrough-may-your-bath-be-your-next-breakthrou?ref=discovery_category_newest,784.0,6,53,53
73,a short film that follows a group of women dancers and artists as they collaborate to create a sitespecific work in the utah desert,Performances,the United States,Telluride Dance Collective,3500,"Telluride, CO",Desert Dance Short Film,4297.0,desert dance short film,True,False,successful,https://www.kickstarter.com/projects/189326040/desert-dance-short-film?ref=discovery_category_newest,4297.0,7,25,25
216,we create handcrafted wood products for enthusiasts of mens grooming artisan coffee fine spirits and quality tobacco,Woodworking,the United States,Dante LaCivita and Reuben Uhlmann,16000,"Springfield, MO",Help Us Stand For Generations To Come.  The 1906 Gents.,21240.0,help us stand for generations to come,True,True,successful,https://www.kickstarter.com/projects/829963631/help-us-stand-for-generations-to-come?ref=discovery_category_newest,21240.0,376,32,32
2,handmade array of beautiful reclaimed wood design projects with a pop of color ring box coaster candle holder clock or wine rack,Woodworking,the United States,Phillip,1200,"Gardiner, NY",Beautiful reclaimed wood design with a pop of color,93.0,beautiful reclaimed wood design with a pop of colo,False,False,failed,https://www.kickstarter.com/projects/1009588390/beautiful-reclaimed-wood-design-with-a-pop-of-colo?ref=discovery_category_newest,93.0,10,25,25
86,a graphic novel about an undead monster who sues a movie studio trying to make a horror film about him,Graphic Novels,the United States,Owen Hammer,4000,"Los Angeles, CA","""Von Bach"" the graphic novel",4151.0,von bach the graphic novel,True,False,successful,https://www.kickstarter.com/projects/the-hammer/von-bach-the-graphic-novel?ref=discovery_category_newest,4151.0,25,30,30
166,a graphic novel miniseries that follows orphan goth girl olive as she tries to find a home for herself in this world and beyond,Graphic Novels,the United States,Emily Felt,9250,"Los Angeles, CA","Olive and the Underworld (Volume 1), a graphic novel",9822.0,olive and the underworld volume 1 a graphic novel,True,False,successful,https://www.kickstarter.com/projects/1058532910/olive-and-the-underworld-volume-1-a-graphic-novel?ref=discovery_category_newest,9822.0,345,30,30
207,the ss mini fidget spinner was designed to be a more discreet spinner that looks and feels high end with out the high end cost,Crafts,the United States,Don Blumenauer Jr.,3000,"Towanda, PA",TruBlu MFG Stainless Steel Mini Fidget Spinner,15520.0,trublu mfg stainless steel mini fidget spinner,True,False,successful,https://www.kickstarter.com/projects/trublumini/trublu-mfg-stainless-steel-mini-fidget-spinner?ref=discovery_category_newest,15520.0,103,30,30
171,everyday carry retractable brass hook tool for opening doors pushing buttons and avoiding touching surfaces,Product Design,the United States,Grant Takara,1000,"Honolulu, HI",Retractable brass hook for avoiding surfaces EDC tool,9108.0,sheathed brass door opener and elevator button pusher edc,True,False,successful,https://www.kickstarter.com/projects/gtscientific/sheathed-brass-door-opener-and-elevator-button-pusher-edc?ref=discovery_category_newest,9108.0,4,13,13
247,power of thor attitude of deadpool a typical slacker becomes hercules superhero comedy action 64page hardcover comic bookextras,Graphic Novels,the United States,Ominous Press,23000,"Tonawanda, NY",Demi-God: My Kick-Ass Graphic Novel! By Ron Marz-Andy Smith,24173.0,demi god my kick ass graphic novel,True,False,successful,https://www.kickstarter.com/projects/dreadgods/demi-god-my-kick-ass-graphic-novel?ref=discovery_category_newest,24173.0,5,30,30
9,we are raising funding to expand our resources to create all new and exciting content for the new future new titles and books,Graphic Novels,the United States,Ted Lody,20,"Chicago, IL",Vamp Nation from Outer Space Graphic Novel Issues 1-8,69.0,vamp nation from outer space graphic novel issues 1 8,True,False,successful,https://www.kickstarter.com/projects/scandallnros2019/vamp-nation-from-outer-space-graphic-novel-issues-1-8?ref=discovery_category_newest,69.0,14,15,15
44,an innovative mobile education center for marginalized homeless and housing insecure children,Civic Design,the United States,CALI INC,40000,"San Diego, CA",Fill the Bus: A mobile education Center,1838.0,fill the bus a mobile education center,False,False,failed,https://www.kickstarter.com/projects/cali1inc/fill-the-bus-a-mobile-education-center?ref=discovery_category_newest,1838.0,5,44,44
129,magnus the brave the debut comic book from artist/creator chris rau tells the story of a superpowered barbarian and his adventures,Comic Books,the United States,Chris Rau,1500,"Kansas City, MO",Magnus The Brave #1 A Bloody Fun Comic Adventure,4931.0,magnus the brave 1 a bloody fun comic adventure,True,False,successful,https://www.kickstarter.com/projects/chrisrauart/magnus-the-brave-1-a-bloody-fun-comic-adventure?ref=discovery_category_newest,4931.0,6,30,30
3,i am an engineer and i hope to help animals in need,Printing,the United States,Devin,8200,"Mishawaka, IN",My 3D Printing Project,114.0,my 3d printing project,False,False,failed,https://www.kickstarter.com/projects/1199246228/my-3d-printing-project?ref=discovery_category_newest,114.0,52,30,30
145,join us for the  next issue of the star scout merope as she attempts to escape the follower,Comic Books,the United States,John Daniel Taylor IV,4200,"Washington, DC",The 7th Sister #2,4276.0,the 7th sister 2,True,False,successful,https://www.kickstarter.com/projects/1582272995/the-7th-sister-2?ref=discovery_category_newest,4276.0,8,36,36
4,developed an ultralightweight concrete technology with the same   features as solid concrete but is 80 lighter,Architecture,the United States,Mark Speccia,10000,"Miami, FL",NuVision Ultra-Lightweight Custom Concrete Furniture,472.0,nuvision ultra lightweight custom concrete furnitu,False,False,canceled,https://www.kickstarter.com/projects/823048584/nuvision-ultra-lightweight-custom-concrete-furnitu?ref=discovery_category_newest,472.0,2,29,20
115, featuring a few of our childhood favorite fantasy friends,Product Design,the United States,LilPawie,500,"Austin, TX",♡Anime Cute Fluffy Friends Hard Enamel Pins ♡,4211.0,ghibli cute fluffy friends hard enamel pins,True,False,successful,https://www.kickstarter.com/projects/lilpawie/ghibli-cute-fluffy-friends-hard-enamel-pins?ref=discovery_category_newest,4211.0,13,20,20
356,a very small leather wallet is handmade that accommodates absolutely everything and it is also rfid protected get one,Product Design,the United States,Andrew Skop,1000,"Mykolayiv, Ukraine",Small Leather Wallet with RFID Protection | BORDO mini,19447.0,small leather wallet with rfid protection bordo mini 0,True,False,successful,https://www.kickstarter.com/projects/andrewskop/small-leather-wallet-with-rfid-protection-bordo-mini-0?ref=discovery_category_newest,19447.0,32,38,38
15,whimsical hand carved and painted santas,Woodworking,the United States,Frank Hailey III,500,"Farmville, VA",Santa is coming to town!,833.0,santa is coming to town,True,False,successful,https://www.kickstarter.com/projects/418548765/santa-is-coming-to-town?ref=discovery_category_newest,833.0,17,45,45
74,a queer horror romcom with superheroes minicomic,Comic Books,the United States,Koltreg,250,"Columbus, OH",Super Slasher Mini-Comic,776.0,super slasher mini comic,True,False,successful,https://www.kickstarter.com/projects/koltreg/super-slasher-mini-comic?ref=discovery_category_newest,776.0,13,30,30
97,a horror/fantasy that follows human and angelic characters as they war against the dark kingdom for the fate of the universe,Graphic Novels,the United States,Brian Rodman,2000,"Louisville, KY",Memoirs of an Angel : The Grey Pilgrim Vol. 1,5383.0,memoirs of an angel the grey pilgrim vol 1,True,True,successful,https://www.kickstarter.com/projects/memoangelcomix/memoirs-of-an-angel-the-grey-pilgrim-vol-1?ref=discovery_category_newest,5383.0,56,30,30
2,remaking new history we moved that 1904 gothic revival stone church 1250 miles to become the anchor of a modern day city square,Architecture,the United States,David and Tara Camp,2000000,"Austin, TX",re-Building With Our Past is the Technology For Our Future!,120.0,re building americas future by reclaiming its past,False,False,canceled,https://www.kickstarter.com/projects/1742029118/re-building-americas-future-by-reclaiming-its-past?ref=discovery_category_newest,120.0,17,45,20
2,affordable elegance and style you can wear whenever wherever,DIY,the United States,RJ Kelly,2000,"Pensacola, FL",All about Pearls (Canceled),20.0,all about pearls,False,False,canceled,https://www.kickstarter.com/projects/jeapetite/all-about-pearls?ref=discovery_category_newest,20.0,6,30,3
38,bright yellow and pink b6 dot grid notebook with rainbow edge printing,Stationery,the United States,RosePaper,200,"Knoxville, TN",B6 Notebook but Make It Bright,972.0,b6 notebook but make it bright,True,False,successful,https://www.kickstarter.com/projects/rosepaper/b6-notebook-but-make-it-bright?ref=discovery_category_newest,972.0,6,10,10
75,kings and slaves lovers and liars epic tales of life and death from the cradle of civilization an original performance by push,Dance,the United States,PUSH Physical Theatre,3000,"Rochester, NY",Arc of Ages,3305.0,arc of ages,True,False,successful,https://www.kickstarter.com/projects/1876231463/arc-of-ages?ref=discovery_category_newest,3305.0,9,21,21
2,a laughable shot at redemption,Graphic Design,the United States,Greg Loumeau,100,"Tucson, AZ",The Seven Dreadly Sins Magnet Set (Make 100) (Canceled),32.0,the seven dreadly sins magnet set make 100,False,False,canceled,https://www.kickstarter.com/projects/1897397514/the-seven-dreadly-sins-magnet-set-make-100?ref=discovery_category_newest,32.0,380,30,6
87,help support dance residency programs in nyckids learn dance and join their teaching artists in dance parade may 18th,Residencies,the United States,Dance Parade,3000,"New York, NY",Dance Residencies that turn Kids into *Stars on Broadway!*,3426.0,dance residencies that make kids stars on broadway,True,False,successful,https://www.kickstarter.com/projects/333018875/dance-residencies-that-make-kids-stars-on-broadway?ref=discovery_category_newest,3426.0,174,21,21
52,yoga for movers is a small business that customizes yoga for  athletes dancers acrobats cheerleaders movers and beyonce,Workshops,the United States,Yoga for Movers,2500,"Los Angeles, CA",Yoga for Movers,3000.0,yoga for movers,True,False,successful,https://www.kickstarter.com/projects/471513287/yoga-for-movers?ref=discovery_category_newest,3000.0,99,30,30
8,i create beautiful and functional art glass to decorate your home whether it be a bowl or plate or custom tiles for your kitchen,Glass,the United States,Janne Rochlin,2000,"Petaluma, CA",J Rocklin Art Glass - My Third Act,240.0,j rocklin art glass my third act,False,False,failed,https://www.kickstarter.com/projects/702356362/j-rocklin-art-glass-my-third-act?ref=discovery_category_newest,240.0,51,30,30
3,castle elysium is the sanctuary for two twin sisters named angel and kairi they will embark on an adventure that will change the world,Webcomics,the United States,Mauricio Valdivia,120,"Fresno, CA",Gemini Twilight - Issue #1 (Webcomic Continuation),35.0,gemini twilight issue 1 webcomic continuation,False,False,failed,https://www.kickstarter.com/projects/geminitwilight1digi/gemini-twilight-issue-1-webcomic-continuation?ref=discovery_category_newest,35.0,2,3,3
60,loudhoundmovement is a new dance collective putting together their first evening length show at cpr on november 2nd and 3rd,Dance,the United States,Brendan Duggan,5000,"Lower East Side, NY",LoudHoundMovement,5396.0,loudhoundmovement,True,False,successful,https://www.kickstarter.com/projects/1880801551/loudhoundmovement?ref=discovery_category_newest,5396.0,27,30,30
3,we create customized laser etched designs on wood glass acrylics metals and leather our goal is to purchase a new laser,Woodworking,the United States,Julie Henderlight-Caligiuri,8500,"Salt Lake City, UT",Custom Laser Design,129.0,salvage sisters laser cafe galvo co2 laser,False,False,failed,https://www.kickstarter.com/projects/1893932545/salvage-sisters-laser-cafe-galvo-co2-laser?ref=discovery_category_newest,129.0,0,30,30
125,kawaii spring themed enamel pins featuring fluffy animals,Crafts,the United States,Mochi Bear Studio,650,"Sacramento, CA",Kawaii Spring Fluff Enamel Pin,2947.0,kawaii spring fluff enamel pin,True,False,successful,https://www.kickstarter.com/projects/mochibearstudio/kawaii-spring-fluff-enamel-pin?ref=discovery_category_newest,2947.0,11,13,13
63,the second issue of the bite of brenna barlow a comic about a telepathic vampire and her sarcastic dachshund sidekick,Comic Books,the United States,Rob Stanley,1000,"Wilkes-Barre, PA",The Bite of Brenna Barlow #2: London Calling,2020.0,the bite of brenna barlow 2 london calling,True,False,successful,https://www.kickstarter.com/projects/robstanley/the-bite-of-brenna-barlow-2-london-calling?ref=discovery_category_newest,2020.0,44,28,28
6,lets build a sustainable boutique eco hotel to share with the worlds surfers artists nature lovers and conscious individuals,Architecture,the United States,Heidi Parker,89000,"Rivas, Nicaragua",Santosha Surf Sanctuary Eco Hotel built by Kickstarter (Canceled),371.0,santosha surf sanctuary eco hotel built by kicksta,False,False,canceled,https://www.kickstarter.com/projects/santosha/santosha-surf-sanctuary-eco-hotel-built-by-kicksta?ref=discovery_category_newest,371.0,547,30,15
2,the colorado international lion dance competition is a chinese lion dance event that promotes education and competition of lion dance,Performances,the United States,Peter Pham,5000,"Denver, CO",Colorado International Lion Dance Competition,21.0,colorado international lion dance competition,False,False,failed,https://www.kickstarter.com/projects/1675767622/colorado-international-lion-dance-competition?ref=discovery_category_newest,21.0,684,60,60
4,make your own diy helicopter and fly it ,DIY,the United States,Nino Scarpato,1000,"Miami, FL",3D Printable Helicopters - HELIPRINTED,142.0,3d printable helicopters heliprinted,False,False,failed,https://www.kickstarter.com/projects/heliprinted/3d-printable-helicopters-heliprinted?ref=discovery_category_newest,142.0,19,30,30
39,bearnstow artists from all over the northeast will come together to create an evening of dance performance music and film,Performances,the United States,3 Spice Dance,1500,"Cambridge, MA",3 Spice Presents,1620.0,3 spice presents,True,False,successful,https://www.kickstarter.com/projects/1608336955/3-spice-presents?ref=discovery_category_newest,1620.0,40,30,30
56,allnew sexy badgirl characters from comic book indie legend everette hartsoe be the 1st to see the 2018 line up color pin ups,Comic Books,the United States,Everette Hartsoe,199,"Las Vegas, NV",BadGirl Sketchbook Color Annual 2018,1636.0,badgirl sketchbook annual 2018,True,False,successful,https://www.kickstarter.com/projects/everettehartsoe/badgirl-sketchbook-annual-2018?ref=discovery_category_newest,1636.0,3,7,7
3,hello i am creating cups from glass bottles primarily beer bottles  to drink out of or to use as a decoration perfect little gift,Glass,the United States,Alexis Gutierrez,3000,"West Covina, CA",Drinking or Decorative cups from Bottles!!! (100% RECYCLE),26.0,drinking or decorative cups from bottles 100 recyc,False,False,failed,https://www.kickstarter.com/projects/1945135308/drinking-or-decorative-cups-from-bottles-100-recyc?ref=discovery_category_newest,26.0,0,30,30
240,when a billionaire heiress returns home to cover up her fathers crime she must confront the dark occult secrets her family is tied to,Comic Books,the United States,Andrew Guilde,4500,"Chicago, IL",Forgotten Hymns- Issue 1 of a Lovecraftian Noir Horror Comic,6076.0,forgotten hymns issue 1 of a lovecraftian noir horror comic,True,True,successful,https://www.kickstarter.com/projects/forgottenhymns/forgotten-hymns-issue-1-of-a-lovecraftian-noir-horror-comic?ref=discovery_category_newest,6076.0,89,30,30
107,aerial haven will be an aerial studio established in north east queens providing aerial classes for all ages and levels,Spaces,the United States,Laura Haley and Danielle Kocal,18000,"Queens, NY",Aerial Haven : Aerial Studio,18791.0,aerial haven aerial studio,True,False,successful,https://www.kickstarter.com/projects/aerialhaven/aerial-haven-aerial-studio?ref=discovery_category_newest,18791.0,7,30,30
11,custom blankets 60 inches by 72 inches long made with 4 yards of super soft antipill fleece that you get to handpick for your home,Crafts,the United States,Ashley Yakubac,200,"Williamsport, PA","Custom 72-inch Blankets, Double-Sided",694.0,custom 72 inch blankets double sided,True,False,successful,https://www.kickstarter.com/projects/customizableblanket1/custom-72-inch-blankets-double-sided?ref=discovery_category_newest,694.0,6,25,25
292,a postapocalyptic western which is an allegory for leaving white supremacist movements,Graphic Novels,the United States,R. Alan Brooks,16000,"Denver, CO",Anguish Garden: The Graphic Novel,16435.0,anguish garden the graphic novel,True,False,successful,https://www.kickstarter.com/projects/anguishgarden/anguish-garden-the-graphic-novel?ref=discovery_category_newest,16435.0,63,59,59
31,the collection of the first 5 years of new comic day its clerks meets looney tunes,Webcomics,the United States,Eric Jason Ratcliffe,6000,"Holden, MA",New Comic Day The 5 Year Journey!,1345.0,new comic day the 5 year journey,False,False,failed,https://www.kickstarter.com/projects/482088835/new-comic-day-the-5-year-journey?ref=discovery_category_newest,1345.0,14,30,30
2,homemade soy candles with an animal crossing twist,Candles,the United States,Savannah Mullen,20000,"Pittsburg, CA",BB's Candles (Canceled),21.0,welcome to my home candles animal crossing themed candles,False,False,canceled,https://www.kickstarter.com/projects/candlesbysavannah/welcome-to-my-home-candles-animal-crossing-themed-candles?ref=discovery_category_newest,21.0,9,17,0
275,this project is to create an illustration and manga compilation book of the tohoku relief character tohoku zunko,Graphic Novels,the United States,Edgebase LLC & GREEN FUNDING,30000,"Tokyo, Japan",Illustration and manga compilation book of Tohoku Zunko,41586.0,illustration and manga compilation book of tohoku,True,False,successful,https://www.kickstarter.com/projects/2002295009/illustration-and-manga-compilation-book-of-tohoku?ref=discovery_category_newest,41586.0,85,29,29
14,finally nononsense practical baby memory books for busy parents help us go from handmade to pressprinted,Graphic Design,the United States,Marissa Gleason,4300,"Orono, MN",No-Nonsense Baby Memory Books,860.0,no nonsense baby memory books,False,False,failed,https://www.kickstarter.com/projects/1067246576/no-nonsense-baby-memory-books?ref=discovery_category_newest,860.0,44,30,30
417,the third chapter in the successful lili the demoness series,Comic Books,the United States,LTorres,3500,"College Station, TX",Lili: The Demoness - Ch. 3 Eternal Sins,23966.0,lili the demoness ch 3 eternal sins,True,False,successful,https://www.kickstarter.com/projects/codexentertainment/lili-the-demoness-ch-3-eternal-sins?ref=discovery_category_newest,23966.0,97,40,40
0,im trying to start my own business making a variety of different scented candles and wax melts,Candles,the United States,Karma,1000,"Decatur, GA",Royal Wickz by Karma (Canceled),0.0,royal wickz,False,False,canceled,https://www.kickstarter.com/projects/1696467648/royal-wickz?ref=discovery_category_newest,0.0,2,30,25
65,overwatch inspired pin set,Crafts,the United States,Pinswags,1500,"Dallas, TX",Halloween Pin Set,1749.0,halloween pin set,True,False,successful,https://www.kickstarter.com/projects/1561594842/halloween-pin-set?ref=discovery_category_newest,1749.0,0,25,25
2,each tapestry weaving needs its own special hues from nature  fibers glass and ceramics are merged in appreciation of natures art,Weaving,the United States,Judith Harney,5000,"Santa Fe, NM",Nature & Fibers in Weaving sculptural landscapes,31.0,nature and fibers in weaving sculptural landscapes,False,False,failed,https://www.kickstarter.com/projects/1799663922/nature-and-fibers-in-weaving-sculptural-landscapes?ref=discovery_category_newest,31.0,0,30,30
2,a game about tossing cute little furry beanie animals across the room for unlimited hours of fun,DIY,the United States,R.A. Armstrong,1000,"Point Harbor, NC",Foxhole,66.0,foxhole 0,False,False,failed,https://www.kickstarter.com/projects/524040126/foxhole-0?ref=discovery_category_newest,66.0,42,30,30
106,the first part of a historical graphic novel that centers on events in ancient athens leading to socrates trial and execution,Comic Books,the United States,Jave Galt-Miller,4500,"Los Angeles, CA",The Trial of Socrates - Part 1,4774.0,the trial of socrates part 1,True,False,successful,https://www.kickstarter.com/projects/polis/the-trial-of-socrates-part-1?ref=discovery_category_newest,4774.0,1,21,21
26,set in the late 1940s breton follies is an elevation of cabaret celebrating the female form and the duality of the spirit,Residencies,the United States,Breton Tyner-Bryan,6500,"Manhattan, NY",Breton Follies,6500.0,breton follies,True,False,successful,https://www.kickstarter.com/projects/bretonfollies/breton-follies?ref=discovery_category_newest,6500.0,2,29,29
40,students create their own choreography by studying martha grahams legendary work and exploring americas political history,Dance,the United States,Martha Graham Center,3300,"New York, NY",Teens@Graham Dance Residency at Harlem High School,3543.0,teensgraham dance residency at harlem high school,True,False,successful,https://www.kickstarter.com/projects/748136388/teensgraham-dance-residency-at-harlem-high-school?ref=discovery_category_newest,3543.0,48,30,30
108,small  cute  hamster  pin,Product Design,the United States,Pistachii,500,"Maple Grove, MN",Small Hamsters: Enamel Pins,3162.0,small hamsters enamel pins,True,False,successful,https://www.kickstarter.com/projects/pistachii/small-hamsters-enamel-pins?ref=discovery_category_newest,3162.0,29,30,30
4,the goal a place for a teen to create nail art in peace the problem funds,DIY,the United States,Emma Drake,600,"San Francisco, CA",Emma's Nail Shack,55.0,emmas nail shack,False,False,failed,https://www.kickstarter.com/projects/1943331638/emmas-nail-shack?ref=discovery_category_newest,55.0,0,30,30
