backers_count,blurb,category,country_displayable_name,creator,goal,location,name,pledged,slug,spotlight,staff_pick,state,urls,usd_pledged,preview_time,fundraising_time,state_change
38,youngsense always insisted on the development of health functional shoes series   youngsensex is a series of functional breathe boots,Footwear,the United States,YOUNGSENSE,5000,"Brooklyn, NY",YOUNGSENSE-X : A new generation of chelsea boot (Canceled),6337.0,youngsense x a new generation of chalsea boots,False,False,canceled,https://www.kickstarter.com/projects/youngsense/youngsense-x-a-new-generation-of-chalsea-boots?ref=discovery_category_newest,6337.0,1,45,44
28,looking for funds to development and produce an animated short film,Animation,the United States,Todd A. Winter,93000,"Houston, TX",Pet Taxi,1753.93,pet taxi,False,False,failed,https://www.kickstarter.com/projects/2108266638/pet-taxi?ref=discovery_category_newest,1753.93,39,30,30
58,a pokemon enamel pin series of impidimps evolution family in japanese oni style,Apparel,the United States,KayDeeFoxx,1580,"New York, NY",Jumpscare: An Oni!Impidimp Evolution Pin Series,2300.0,jumpscare an oniimpidimp evolution pin series,True,False,successful,https://www.kickstarter.com/projects/animalarithmetic/jumpscare-an-oniimpidimp-evolution-pin-series?ref=discovery_category_newest,2300.0,0,21,21
2,bringing the world of sugar  bling together to create a sweet and fashionable business,Jewelry,the United States,CUPCAKES AND JEWELZ,8000,"Houston, TX","Sugar & Bling, It's Everybodys Thing!",86.0,sugar and bling its everybodys thing,False,False,failed,https://www.kickstarter.com/projects/751422184/sugar-and-bling-its-everybodys-thing?ref=discovery_category_newest,86.0,34,30,30
1,a married couple that lived happily until they raised seven orphans from a corrupt child abductive service,Action,the United States,CJ Harry,75000,"New Orleans, LA",Approach: Saving our Youth from Issues to Meet the Future,100.0,approach,False,False,canceled,https://www.kickstarter.com/projects/914414609/approach?ref=discovery_category_newest,100.0,20,30,16
775,magical 5th edition enamel pins inspired by nature,Accessories,the United States,Paola Harris,3000,"Reno, NV",Natural Defenses Enamel Pins,23652.0,natural defenses enamel pins,True,False,successful,https://www.kickstarter.com/projects/irrel/natural-defenses-enamel-pins?ref=discovery_category_newest,23652.0,18,15,15
857,were making topquality boots in the usa and cutting out the retail markup in order to make our products more accessible,Footwear,the United States,Brooklyn Boot,50000,"Martinsburg, PA",Brooklyn Boot Company,117817.0,brooklyn boot company,True,True,successful,https://www.kickstarter.com/projects/1053586392/brooklyn-boot-company?ref=discovery_category_newest,117817.0,31,30,30
154,a series of enamel pins inspired by spirited away,Accessories,the United States,Vivian,1600,"Los Angeles, CA",Cute Spirited Away Enamel Pins,6233.0,cute spirited away enamel pins,True,False,successful,https://www.kickstarter.com/projects/1925735732/cute-spirited-away-enamel-pins?ref=discovery_category_newest,6233.0,1,30,30
310,an exact recreation of the 1974 klettersack by the original wilderness experience team original pattern materials  quality,Accessories,the United States,Icon Originals LLC,20000,"Mammoth Lakes, CA",The Original Klettersack™ from Wilderness Experience®,37034.0,the original klettersacktm from wilderness experie,True,False,successful,https://www.kickstarter.com/projects/iconoriginals/the-original-klettersacktm-from-wilderness-experie?ref=discovery_category_newest,37034.0,119,54,54
14, a dance film exploring human control  surrendering to the elements around us ,Film & Video,the United States,Melanie Katzen,1500,"Los Angeles, CA",calm sets in,1778.0,calm sets in,True,False,successful,https://www.kickstarter.com/projects/melaniekatzen/calm-sets-in?ref=discovery_category_newest,1778.0,1,28,28
59,we are doing a soft launch with 1 hat and 1 shirt design with more options with our full launch please read our story and share,Apparel,the United States,Bryant Spratlin,2500,"Pensacola, FL",Help us Launch OSSO Apparel,2885.0,help us launch osso apparel,True,False,successful,https://www.kickstarter.com/projects/1154714360/help-us-launch-osso-apparel?ref=discovery_category_newest,2885.0,12,30,30
429,an original scripted series by trilogy media from youtube,Drama,the United States,Trilogy Media,15000,"Los Angeles, CA",THE CHEAT: An Original Series By Trilogy Media,67602.99,the cheat an original series by trilogy media,True,False,successful,https://www.kickstarter.com/projects/trilogymedia/the-cheat-an-original-series-by-trilogy-media?ref=discovery_category_newest,67602.99,10,30,30
99,we want to print as many rusty shirts as possible and pass on his enthusiasm for life and for god,Graphic Design,the United States,Ricky Barbosa,2500,"College Place, WA",The Rusty Project,2637.0,the rusty project,True,False,successful,https://www.kickstarter.com/projects/424092161/the-rusty-project?ref=discovery_category_newest,2637.0,2,15,15
53,the shadow game of ideas learn design thinking with fun play,Toys,the United States,Shivani Chakrachhattri,12960,"Boston, MA",Bulby for kids (Old Campaign) (Canceled),6176.0,bulby be genius,False,False,canceled,https://www.kickstarter.com/projects/bulby/bulby-be-genius?ref=discovery_category_newest,6176.0,528,45,38
28,an indiana jones style fantasy adventure film we follow fortune hunter robyn as she seeks the treasure of the sun god toltec,Animation,the United States,Bailey Grace Sitton,3000,"Dahlonega, GA",A Tale of Two Worlds : Senior Thesis Animation,770.0,a tale of two worlds senior thesis animation,False,False,failed,https://www.kickstarter.com/projects/baileygracesitton/a-tale-of-two-worlds-senior-thesis-animation?ref=discovery_category_newest,770.0,32,30,30
11,show your love for exploring the beautiful and breathtaking state of oregon with this awesome sticker/decal,Graphic Design,the United States,Ryan Fordham,500,"Corvallis, OR",Explore Oregon Sticker,133.0,explore oregon sticker,False,False,failed,https://www.kickstarter.com/projects/fordhamr/explore-oregon-sticker?ref=discovery_category_newest,133.0,1,30,30
100,a luxury footwear collection designed by fe castleberry handmade in england sold directtoconsumer,Footwear,the United States,Frederick Egan Castleberry,45000,"New York, NY",F.E. Castleberry Footwear: luxury made the old-fashioned way,47122.0,fe castleberry footwear luxury made the old fashioned way,True,True,successful,https://www.kickstarter.com/projects/fecastleberry-shoes/fe-castleberry-footwear-luxury-made-the-old-fashioned-way?ref=discovery_category_newest,47122.0,15,30,30
1,the 21st century blacklights are illuminated change colors and respond to music with varying color intensity and pulsating light,Graphic Design,the United States,David Wagoner,154000,"Silver Spring, MD",21st Century Blackights Poster Tech,1.0,21st century blackights poster tech,False,False,failed,https://www.kickstarter.com/projects/dfw/21st-century-blackights-poster-tech?ref=discovery_category_newest,1.0,13,28,28
47,a short animated film about maurice the mooseduck,Shorts,the United States,Jeffrey Delano Davis,3000,"Red Bank, NJ","The Mooseduck: A Short, Squat Film",3085.0,the mooseduck a short squat film,True,False,successful,https://www.kickstarter.com/projects/delanodavisprod/the-mooseduck-a-short-squat-film?ref=discovery_category_newest,3085.0,38,44,44
254,patented insulated clothing technology no need for multiple layers warm even if wet never be cold again and help homeless be warm,Apparel,the United States,Fortress Clothing,22000,"Nephi, UT",Insulated Base Layer & Gloves • Always Warm - Even if Wet,46264.0,basepro and glovepro insulated next to skin techno,True,False,successful,https://www.kickstarter.com/projects/802014879/basepro-and-glovepro-insulated-next-to-skin-techno?ref=discovery_category_newest,46264.0,61,38,38
8,if you like to look elegant if you are not willing to compromise on quality and you only want to pay what is reasonable,Ready-to-wear,the United States,Candore LLC,35000,"Manhattan, NY",What Every Woman Needs CANDORE - Made In Italy,1802.0,what every woman needs candore made in italy,False,False,failed,https://www.kickstarter.com/projects/557291995/what-every-woman-needs-candore-made-in-italy?ref=discovery_category_newest,1802.0,18,31,31
198,with your help april will no longer be known for tom foolery but rathertom hanks,Graphic Design,the United States,Kevin Turk,9000,"Chicago, IL",International Tom Hanks Day,10120.0,international tom hanks day,True,True,successful,https://www.kickstarter.com/projects/320857786/international-tom-hanks-day?ref=discovery_category_newest,10120.0,596,39,39
12,elegant engraved birthday cards,Graphic Design,the United States,Morgan Itterly,100,"Chicago, IL",Luxe: Handmade Greeting Cards,171.0,luxe handmade greeting cards,True,False,successful,https://www.kickstarter.com/projects/morganitterly/luxe-handmade-greeting-cards?ref=discovery_category_newest,171.0,1,5,5
929,kippo shorts are built to workout with your smartphone no phone flopping do a handstand no dropping easy access,Apparel,the United States,Mark Kinsley,50000,"Los Angeles, CA",Smartphone Workout Shorts. Better Than Armbands.,64563.0,smartphone workout shorts better than armbands,True,True,successful,https://www.kickstarter.com/projects/84808747/smartphone-workout-shorts-better-than-armbands?ref=discovery_category_newest,64563.0,505,30,30
34,hard enamel pins and a sticker,Accessories,the United States,Jeya S,500,"Los Angeles, CA",Star Drink Pins,790.0,star drink pins,True,False,successful,https://www.kickstarter.com/projects/kiioyocostarpins/star-drink-pins?ref=discovery_category_newest,790.0,6,18,18
0,clothing for girls that are beautifully and uniquely made like a butterfly,Childrenswear,the United States,Virginia Lynn,10000,"Gainesville, FL",4 Girlz By Girlz,0.0,4 girlz by girlz,False,False,failed,https://www.kickstarter.com/projects/1707963650/4-girlz-by-girlz?ref=discovery_category_newest,0.0,8,21,21
37,new wax formula and design,Product Design,the United States,Ireland Pellegrino,3000,"Kennesaw, GA",Fur Every Home Paw Balm Candles- New and Improved,3134.0,new and improved fur every home paw balm candles,True,False,successful,https://www.kickstarter.com/projects/newcandlesfeh/new-and-improved-fur-every-home-paw-balm-candles?ref=discovery_category_newest,3134.0,4,32,32
75,the good roll is the worlds first fullycustomizable nontoxic chiropractic pillow it corrects and improves posture while you sleep,Accessories,the United States,Dr. KenGee Ehrlich,10000,"Los Angeles, CA","The Good Roll: Pain Reducing, Posture Correcting, Custom-Fit",14318.0,the good roll non toxic custom fit chiropractic pi,True,False,successful,https://www.kickstarter.com/projects/1884218761/the-good-roll-non-toxic-custom-fit-chiropractic-pi?ref=discovery_category_newest,14318.0,11,38,38
184,red hood tfs season 3 follows the batman red hood red robin and damian wayne as they fight to save gotham from the tyranny of bane,Webseries,the United States,Ian Lang,10000,"Los Angeles, CA",Red Hood: The FAN Series Season 3!,21061.72,red hood the fan series season 3,True,False,successful,https://www.kickstarter.com/projects/cd828/red-hood-the-fan-series-season-3?ref=discovery_category_newest,21061.72,7,20,20
37,brought to you by beach family productions and schmengie inc,Comedy,the United States,Beach Family Productions,3000,"Long Beach, CA",Annabel: a new comedy web series!,3426.0,annabel a new comedy web series,True,False,successful,https://www.kickstarter.com/projects/annabeltheseries/annabel-a-new-comedy-web-series?ref=discovery_category_newest,3426.0,53,21,21
2140,a story of a new frontier in greenhouse design a greenhouse that stays warm through a montana winter with zero electricity or fuel,Documentary,the United States,paul wheaton,14390,"Missoula, MT",Devious Experiments for a Truly Passive Greenhouse! (Movie),97974.59,greenhouse 1,True,False,successful,https://www.kickstarter.com/projects/paulwheaton/greenhouse-1?ref=discovery_category_newest,97974.59,10,31,31
164,a series of fun enamel pins inspired by the wizarding world,Accessories,the United States,Jenna Rosenthal,500,"San Mateo, CA",Wizarding Joke Shop Enamel Pins by Swish & Flick,8798.0,wizarding joke shop enamel pins by swish and flick,True,False,successful,https://www.kickstarter.com/projects/swishandflickco/wizarding-joke-shop-enamel-pins-by-swish-and-flick?ref=discovery_category_newest,8798.0,9,14,14
170,a line of joggerstyle pants and circle skirts with lgbt flaginspired designs that fit a variety of body types,Apparel,the United States,Fresh Hot Flavors,10000,"Dallas, TX",Pixel Pride Pants and Skirts - LGBT Everyday Fashion,11359.0,pixel pride pants and skirts lgbt everyday fashion,True,False,successful,https://www.kickstarter.com/projects/freshhotflavors/pixel-pride-pants-and-skirts-lgbt-everyday-fashion?ref=discovery_category_newest,11359.0,42,30,30
1533,reusable bags made from vegetable starch harmless for wildlife organic  fully compostable environmentally clean bags  wraps,Product Design,the United States,A-Zero,8000,"Denver, CO",A-Zero Bags: the eco-friendly replacement for plastics,108865.01,a zero organic and bio compostable bags with inspiring art,True,False,successful,https://www.kickstarter.com/projects/eco-friendly-designs/a-zero-organic-and-bio-compostable-bags-with-inspiring-art?ref=discovery_category_newest,108865.01,33,59,59
4,a modern useful hip bag,Accessories,the United States,David,8000,"New York, NY",4GON Hip Bag,532.0,4gon hip bag,False,False,live,https://www.kickstarter.com/projects/4gon/4gon-hip-bag?ref=discovery_category_newest,532.0,31,35,0
1,"brightboldcolorfulcaptivating 
unique pieces that add a pop of color to any outfit",Jewelry,the United States,samantha ashikari,200,"Charleston, SC",BBCC Bracelets,21.0,bbcc bracelets,False,False,failed,https://www.kickstarter.com/projects/305723816/bbcc-bracelets?ref=discovery_category_newest,21.0,4,30,30
8,this is a valet kit designed for shoe care containing brushes shine cloths polish and shoe horn enclosed in a real maple wooden box,Footwear,the United States,FeetPeople LLC,5000,"Hickory, NC",FeetPeople Shoe Care/Polish Valet Kit,394.0,feetpeople shoe care polish valet kit,False,False,failed,https://www.kickstarter.com/projects/1319279953/feetpeople-shoe-care-polish-valet-kit?ref=discovery_category_newest,394.0,168,30,30
175,a debut collection of kids clothing designed to honor artisans and invest in the empowerment and education of kids in our communities,Childrenswear,the United States,Matthew Aprile,20000,"Brooklyn, NY",indi kids: Artisan Made Indigo Clothing for Your Little Ones,23009.0,indi kids artisan made indigo clothing for your li,True,True,successful,https://www.kickstarter.com/projects/1734265793/indi-kids-artisan-made-indigo-clothing-for-your-li?ref=discovery_category_newest,23009.0,8,30,30
3,preprek early education 3d animation programing with music,Animation,the United States,Juanell Primus,115000,"Orlando, FL",QueePower Media,22.0,queepower media,False,False,failed,https://www.kickstarter.com/projects/queepower/queepower-media?ref=discovery_category_newest,22.0,8,59,59
0,after making  cartoons with free ms movie maker  ms paint i need pro software for potential robot chicken type series of short toons,Animation,the United States,Bald Mike Toons,3500,"New York, NY",Bald Mike Toons,0.0,bald mike toons,False,False,failed,https://www.kickstarter.com/projects/baldmiketoons/bald-mike-toons?ref=discovery_category_newest,0.0,23,60,60
7,combining dominics cartoon world of using confidence to accomplish anything with real life cooking and lessons for life,Animation,the United States,Steve Bonasia,5000,"Madison, MS",The Dominic Project,267.0,the dominic project,False,False,failed,https://www.kickstarter.com/projects/chefsb/the-dominic-project?ref=discovery_category_newest,267.0,86,46,46
231,steve jobs believed the computer is like a bicycle for our minds this is a poster series illustrating that wonderful metaphor,Graphic Design,the United States,Michael Mulvey,4000,"New York, NY",Bicycles For Our Minds,5116.29,bicycles for our minds,True,True,successful,https://www.kickstarter.com/projects/combustion/bicycles-for-our-minds?ref=discovery_category_newest,5116.29,4,30,30
33,a biology themed enamel pin set featuring an animal cell plant cell and everyones favorite grumpy old grampa  the bacteria cell,Accessories,the United States,Kelsey Seale,300,"Philadelphia, PA",Biology Cutie Cells - Enamel Pins,568.0,biology cutie cells enamel pins,True,False,successful,https://www.kickstarter.com/projects/474096442/biology-cutie-cells-enamel-pins?ref=discovery_category_newest,568.0,3,30,30
1,please help me open up the 1st  only candy glitz kickz costumes in mississippi thank you,Childrenswear,the United States,Memory,8599,"Jackson, MS",Candy Glitz Kickz Costumes,20.0,candy glitz kickz costumes,False,False,failed,https://www.kickstarter.com/projects/570609306/candy-glitz-kickz-costumes?ref=discovery_category_newest,20.0,4,45,45
27,enamel lapel pins,Accessories,the United States,Mo Boyer,300,"Indianapolis, IN",Garden of Kitties,526.0,garden of kitties,True,False,successful,https://www.kickstarter.com/projects/pochuri/garden-of-kitties?ref=discovery_category_newest,526.0,14,40,40
3,profit from my past failures these are the book covers you need to make your daily dose of serotonin skyrocket plus postcards,Graphic Design,the United States,Kerry Ellis,1500,"Mountain View, CA",Book Covers for Rent,7.0,book covers for rent,False,False,failed,https://www.kickstarter.com/projects/kerryellis/book-covers-for-rent?ref=discovery_category_newest,7.0,0,21,21
55,shambling through the forest moons underbrush comes this lovable tribe of terror,Apparel,the United States,AlphaNerd,20,"San Antonio, TX",Ewoking Dead T-Shirt,1347.0,ewoking dead t shirt,True,False,successful,https://www.kickstarter.com/projects/507431118/ewoking-dead-t-shirt?ref=discovery_category_newest,1347.0,92,30,30
202,save time save feed save money,Product Design,the United States,Tom & Katie Carter,10000,"Wilmington, NC",CoopWorx Feed Silo,36518.0,coopworxtm feed silo,True,False,successful,https://www.kickstarter.com/projects/coopworx/coopworxtm-feed-silo?ref=discovery_category_newest,36518.0,69,39,39
25,a collection of pagan witchy and occult themed enamel pins,Accessories,the United States,Aly Kelly,300,"South Elgin, IL",Pagan Pins 2.0,572.0,pagan pins 20,True,False,successful,https://www.kickstarter.com/projects/adorablykowai/pagan-pins-20?ref=discovery_category_newest,572.0,3,8,8
3,not my president tshirt multilingual text ecofriendly water based black ink screen printed tshirt white american apparel shirts,Apparel,the United States,B,20,"San Francisco, CA","Not My President T-shirt Multilingual Text, American Apparel",51.0,not my president t shirt multilingual text america,True,False,successful,https://www.kickstarter.com/projects/1417540314/not-my-president-t-shirt-multilingual-text-america?ref=discovery_category_newest,51.0,3,25,25
646,the handcrafted bluetooth speaker with superb bass performance and topnotch design that echoes your music taste,Product Design,the United States,Celia & Perah,3000,"Taipei City, Taiwan",CELIA & PERAH R3/R4: A Mixture of Sound & Craftsmanship,92457.0,celia and perah r3 r4 a mixture of sound and craftsmanship,True,False,successful,https://www.kickstarter.com/projects/celia-and-perah-r3r4/celia-and-perah-r3-r4-a-mixture-of-sound-and-craftsmanship?ref=discovery_category_newest,92457.0,35,58,58
1,scootergirl gloves,Childrenswear,the United States,Squire Wells,300,"Fort Myers, FL",Scootergirl Gloves (Canceled),1.0,scootergirl gloves,False,False,canceled,https://www.kickstarter.com/projects/scootergirlhelmets/scootergirl-gloves?ref=discovery_category_newest,1.0,2,27,10
18,great jewelry for you help in the studio for me  join me on this exciting phase of my journey,Jewelry,the United States,Laura Stamper,15000,"New Hope, MN",Expanding the Studio --Laura Stamper Designs,875.0,expanding the studio laura stamper designs,False,False,failed,https://www.kickstarter.com/projects/314741160/expanding-the-studio-laura-stamper-designs?ref=discovery_category_newest,875.0,67,30,30
145,help us complete this beautiful and haunting portrait of life after land the suspense mystery and struggle unfolds in fathoms,Animation,the United States,Mografi,7500,"Brooklyn, NY",FATHOMS - an animated sci-fi film with heart,19631.22,fathoms an animated sci fi film with heart,True,True,successful,https://www.kickstarter.com/projects/mografi/fathoms-an-animated-sci-fi-film-with-heart?ref=discovery_category_newest,19631.22,39,30,30
281,"for the first time all 72 pinsr
 a complete set of demon seals from the lesser key of solomon ars goetia the full sigil set available",Jewelry,the United States,Arthur Pittsley,4000,"Buffalo Center, IA",Demon Sigil Pins Full 72 Demon set The Lesser Key of Solomon,21566.0,demon sigil pins full 72 demon set the lesser key,True,False,successful,https://www.kickstarter.com/projects/casting/demon-sigil-pins-full-72-demon-set-the-lesser-key?ref=discovery_category_newest,21566.0,29,29,29
119,by zenmoon,Accessories,the United States,Annette R. & Christine H.,3000,"Chicago, IL",Inspired Face Masks,3718.0,inspired face masks,True,False,successful,https://www.kickstarter.com/projects/zenmoonmasks/inspired-face-masks?ref=discovery_category_newest,3718.0,49,30,30
156,tie a ribbon around your finger so you dont forget  take care of yourself,Accessories,the United States,Jini Valence,350,"Richmond, VA",Mental Health Reminder Pins,3369.0,mental health reminder pins,True,False,successful,https://www.kickstarter.com/projects/jinintonic/mental-health-reminder-pins?ref=discovery_category_newest,3369.0,2,21,21
37,the laughing magician pin,Accessories,the United States,Matt Star,400,"Taunton, MA",John Constantine Enamel Pin,671.0,john constantine enamel pin,True,False,successful,https://www.kickstarter.com/projects/thestarrycat/john-constantine-enamel-pin?ref=discovery_category_newest,671.0,23,30,30
38,15yearold dara creates unique polished rosewood necklaces accented with turquoise awesome,Jewelry,the United States,Ira Dember,400,"Austin, TX",Necklaces by Dara,1616.0,necklaces by dara,True,False,successful,https://www.kickstarter.com/projects/1708569871/necklaces-by-dara?ref=discovery_category_newest,1616.0,301,30,30
2,"a new watch brand with the rare last
name bongiovi help bring this project to life a watch name like no other",Jewelry,the United States,Steven Bongiovi (deleted),50000,"Long Island, NY",Bongiovi Watch Company (Canceled),101.0,bongiovi watch company,False,False,canceled,https://www.kickstarter.com/projects/bongioviwatch/bongiovi-watch-company?ref=discovery_category_newest,101.0,3,41,12
17,its so light you wont even notice the explorer edition wooden watch series made with 100 natural wood and genuine leather straps,Ready-to-wear,the United States,Villoni Würfel,4885,"Clearwater, FL","Explorer Edition, Wooden Watch Series by Villoni Würfel (Canceled)",1819.0,wooden watch series by villoni wurfel,False,False,canceled,https://www.kickstarter.com/projects/villoniwurfel/wooden-watch-series-by-villoni-wurfel?ref=discovery_category_newest,1819.0,393,60,59
16,explosive fashion,Couture,the United States,Brandon Kennedy,5000,"Aliso Viejo, CA",Punch City Collections,1026.0,punch city collections,False,False,failed,https://www.kickstarter.com/projects/1079065305/punch-city-collections?ref=discovery_category_newest,1026.0,4,29,29
11,your new favorite lbdthese two little black maxidresses are amazing additions to your wardrobe sure to be a goto piece for you,Ready-to-wear,the United States,Victoria Shaffer Designs,10000,"Las Vegas, NV",BLESSED....fashion for the soul,870.0,blessedfashion for the soul,False,False,failed,https://www.kickstarter.com/projects/1324653812/blessedfashion-for-the-soul?ref=discovery_category_newest,870.0,190,30,30
5259,the legend has returned in this exciting live action series,Science Fiction,the United States,Bat in the Sun,100000,"Hollywood, CA",THE WHITE DRAGON,508618.53,the white dragon 0,True,True,successful,https://www.kickstarter.com/projects/batinthesun/the-white-dragon-0?ref=discovery_category_newest,508618.53,14,60,60
0,my friends and i started shooting for fun a decided to put it online we had good feedback but we just need better equipment,Action,the United States,"Kyle, Zach and Noah",5000,"Durham, NC",Backwoods Ballin',0.0,backwoods ballin,False,False,failed,https://www.kickstarter.com/projects/818858293/backwoods-ballin?ref=discovery_category_newest,0.0,0,24,24
318,we want to bring the dumpling emoji to life and pave the way for a more inclusive catalog of emojis,Graphic Design,the United States,Emojination,3750,"San Francisco, CA",Where Is the Dumpling Emoji?,12478.38,where is the dumpling emoji,True,True,successful,https://www.kickstarter.com/projects/657685639/where-is-the-dumpling-emoji?ref=discovery_category_newest,12478.38,6,57,57
463,brand new 2k restorations and bluray/dvd rerelease of very rare 1920s animated cartoons by famed animator and producer walter lantz,Animation,the United States,Tommy José Stathes,16900,"New York, NY",Cartoon Roots: Dinky Doodle & Co. — Blu-ray & DVD combo,38565.0,cartoon roots dinky doodle and co blu ray and dvd combo,True,True,successful,https://www.kickstarter.com/projects/tommyjose/cartoon-roots-dinky-doodle-and-co-blu-ray-and-dvd-combo?ref=discovery_category_newest,38565.0,3,40,40
