backers_count,blurb,category,country_displayable_name,creator,goal,location,name,pledged,slug,spotlight,staff_pick,state,urls,usd_pledged,preview_time,fundraising_time,state_change
4,experimental journey in                                        space,Chiptune,the United States,h4Ⅹ0r,42,"Las Vegas, NV",Yhane Onff 🎧 ʙʀᴇᴀᴋ ᴋɪᴄᴋꜱᴛᴀʀᴛᴇʀ,46.0,def con 27 badgelife yhane onff,True,True,successful,https://www.kickstarter.com/projects/hxr/def-con-27-badgelife-yhane-onff?ref=discovery_category_newest,46.0,131,9,9
133,olivers third studio album offers uplifting music for a challenging time,Classical Music,the United States,Oliver Caplan,15000,"Medford, MA",Watershed,17327.0,watershed 0,True,False,successful,https://www.kickstarter.com/projects/olivercaplan/watershed-0?ref=discovery_category_newest,17327.0,4,33,33
0,ladies only network sensitive issues and timeout for the girl in you relationships movie night fashion cosmetics jobs,Web,the United States,Juliet & Jude Ighere,92300,"Beaverton, OR","LadysDayOut Social Media and Networking, Hotspots",0.0,ladysdayout social media and networking hotspots,False,False,failed,https://www.kickstarter.com/projects/701192122/ladysdayout-social-media-and-networking-hotspots?ref=discovery_category_newest,0.0,3,45,45
0,making sense out of what seems to be in short supply these days,Print,the United States,Jonathan Lipaj,10000,"Columbus, OH",Uncommon Sense,0.0,uncommon sense,False,False,failed,https://www.kickstarter.com/projects/148510773/uncommon-sense?ref=discovery_category_newest,0.0,3,27,27
2,stonercleanupinitiative plans to organize environmental projects to make tomorrow a better world,Web,the United States,Jon,42000,"Louisville, KY",#StonerCleanUpInitiative,5.0,stonercleanupinitiative,False,False,failed,https://www.kickstarter.com/projects/632981466/stonercleanupinitiative?ref=discovery_category_newest,5.0,0,60,60
1,a guided journal for people with type 1 diabetes and their crews,Print,the United States,Susan Baumgartner,1000,"Milwaukee, WI",Let's Make A Book for and By T1D Warriors,5.0,lets make a book for and by t1d warriors,False,False,failed,https://www.kickstarter.com/projects/1905431771/lets-make-a-book-for-and-by-t1d-warriors?ref=discovery_category_newest,5.0,3,29,29
62,after years of loving and playing his music i am putting out an album of chopins piano music beautiful gems that must stay fresh and alive,Classical Music,the United States,Melody Fader,3500,"New York, NY",Melody's Chopin CD,3731.0,melodys chopin cd,True,False,successful,https://www.kickstarter.com/projects/877117052/melodys-chopin-cd?ref=discovery_category_newest,3731.0,14,40,40
1,skyi we are two insanely creative brothers with a dream of looking out onto a crowd with that view in three to five years need help,Electronic Music,the United States,Ilya and Yuriy,3000,"Nashville, TN",SKYI,30.0,skyi,False,False,failed,https://www.kickstarter.com/projects/620398025/skyi?ref=discovery_category_newest,30.0,28,30,30
54,play any card game you already know and love but with fantasy races orcs elves dwarves and humans replacing the traditional suits,Playing Cards,the United States,Catatomic Studios,1200,"Clifton Park Center, NY",Fantasy Themed Playing Cards - CROSS REALMS (Relaunch),1742.0,fantasy themed playing cards cross realms relaunch,True,False,successful,https://www.kickstarter.com/projects/catatomicstudios/fantasy-themed-playing-cards-cross-realms-relaunch?ref=discovery_category_newest,1742.0,3,31,31
241,colored acrylic mounts in all shapes and sizes usable for all tabletop rpgs,Tabletop Games,the United States,Arcknight,1000,"Fort Worth, TX",RPG Mini Mounts,10434.0,rpg mini mounts,True,False,successful,https://www.kickstarter.com/projects/arcknight/rpg-mini-mounts?ref=discovery_category_newest,10434.0,11,21,21
656,dragon the game is a openworld sandbox action rpg and dragon simulator  experience a game unlike any other,Video Games,the United States,Grant Williams -- Red Level Games,30000,"Richland, WA",Dragon: The Game,35417.54,dragon the game,True,False,successful,https://www.kickstarter.com/projects/dragonthegame/dragon-the-game?ref=discovery_category_newest,35417.54,71,30,30
258,32 neverbeforeseen npc miniatures for dnd dungeons  dragons pathfinder warhammer and all roleplaying games a new rpg kickstarter,Tabletop Games,the United States,Monster Gaming,10000,"Trumbull, CT",D&D Inspired TOWNSFOLK Mini Figures By Monster Gaming,29685.0,monster adventure townsfolk minis,True,False,successful,https://www.kickstarter.com/projects/monstergaming/monster-adventure-townsfolk-minis?ref=discovery_category_newest,29685.0,47,30,30
268,the new album,Music,the United States,James Moors & Kort McCumber,25000,"Boulder, CO",Moors & McCumber - Survival,40846.0,moors and mccumber survival,False,False,live,https://www.kickstarter.com/projects/moorsandmccumber/moors-and-mccumber-survival?ref=discovery_category_newest,40846.0,15,31,0
1,i fell in love with julia childs kindred cooking spirit  am traveling in her footsteps to parisian restaurants markets  kitchens,Web,the United States,Caroline,462,"Paris, France",Julia Child at Heart,18.0,julia child at heart,False,False,failed,https://www.kickstarter.com/projects/1233080288/julia-child-at-heart?ref=discovery_category_newest,18.0,0,15,15
77,help finish production on a documentary about issues people face on both sides of the arizonasonora border,Journalism,the United States,Austin Counts,1500,"Tucson, AZ",THE BORDER: Issues in the Arizona-Sonora Borderlands,2581.0,the border issues in the arizona sonora borderland,True,False,successful,https://www.kickstarter.com/projects/1125077588/the-border-issues-in-the-arizona-sonora-borderland?ref=discovery_category_newest,2581.0,0,58,58
4,its mouse vs cat with a new take on redlight greenlight featuring simple controls addicting mazes and custom pixel art,Mobile Games,the United States,McCartney Leopardi,500,"Charlotte, NC",Sneak Mouse (an iOS game),517.0,sneak mouse an ios game,True,False,successful,https://www.kickstarter.com/projects/1921077826/sneak-mouse-an-ios-game?ref=discovery_category_newest,517.0,1,30,30
233,a christian review,Print,the United States,Jake Meador,35000,"Lincoln, NE",Mere Orthodoxy,37117.51,mere orthodoxy,True,False,successful,https://www.kickstarter.com/projects/mereorthodoxy/mere-orthodoxy?ref=discovery_category_newest,37117.51,13,30,30
120,verity vare reveals the truth about beauty by telling one womans story at a time and now were printing a magazine,Print,the United States,Verity Vareé,3500,"Washington, DC",Verity Vareé Magazine,7333.0,verity varee magazine,True,True,successful,https://www.kickstarter.com/projects/verityvaree/verity-varee-magazine?ref=discovery_category_newest,7333.0,258,28,28
4,"grassroots effort to change the healthcare system in america for good 
the healthcure show on voiceamerica to never get sick again",Web,the United States,Nicholas St Jon N.a.MD,6700,"Phoenix, AZ",The HealthCure Show (Canceled),225.0,the healthcure show,False,False,canceled,https://www.kickstarter.com/projects/727425568/the-healthcure-show?ref=discovery_category_newest,225.0,3,27,22
36,a 1  4 player expanded board game version of the original card placement game,Tabletop Games,the United States,John H. Kohn,40,"Burke, VA",Lightning Strike! 2 - the board game (PnP),369.0,lightning strike 2 the board game pnp,True,False,successful,https://www.kickstarter.com/projects/1438234520/lightning-strike-2-the-board-game-pnp?ref=discovery_category_newest,369.0,50,16,16
556,eliza gilkyson is making her new album secularia  be a part of this project,Country & Folk,the United States,Eliza Gilkyson,45000,"Austin, TX",SECULARIA: The New Eliza Gilkyson Album,51547.0,secularia the new eliza gilkyson album,True,False,successful,https://www.kickstarter.com/projects/24452398/secularia-the-new-eliza-gilkyson-album?ref=discovery_category_newest,51547.0,111,30,30
1214,add a touch of horror to your dnd 5e game with this beautiful bestiary of over 40 eldritch beasts mythos minions and great old ones,Tabletop Games,the United States,Legendary Games,500,"Federal Way, WA",Mythos Monsters: 40+ Lovecraftian horrors for DnD 5E,31397.0,mythos monsters 40 lovecraftian horrors for dnd 5e,True,False,successful,https://www.kickstarter.com/projects/legendarygames/mythos-monsters-40-lovecraftian-horrors-for-dnd-5e?ref=discovery_category_newest,31397.0,21,15,15
42,i will be starting a music class for  babies  toddlers to connect to other moms and their children in our community through music,Kids,the United States,Sarah Hindin,1000,"Huauchinango, Mexico",Baby/Toddler Music Class,2020.0,baby toddler music class,True,False,successful,https://www.kickstarter.com/projects/musicclass/baby-toddler-music-class?ref=discovery_category_newest,2020.0,11,31,31
97,honey magpie a fivepiece indiefolk band from chapel hill nc will record their debut album this november and needs your help,Country & Folk,the United States,Honey Magpie,2999,"Chapel Hill, NC",Honey Magpie's Debut Album,3730.0,honey magpies debut album,True,True,successful,https://www.kickstarter.com/projects/honeymagpie/honey-magpies-debut-album?ref=discovery_category_newest,3730.0,18,30,30
167,a demons  carbines ttrpg inspired by the expanse and doom,Tabletop Games,the United States,Will Power Games,6000,"Los Angeles, CA",Death Divers: A Heroic Dark Setting,6474.0,death divers a heroic dark setting,True,False,successful,https://www.kickstarter.com/projects/willpowergames/death-divers-a-heroic-dark-setting?ref=discovery_category_newest,6474.0,37,35,35
39,the applegate valley ohv project will document the impacts of unauthorized and unmanaged ohv use in the siskiyou mountains,Web,the United States,Luke Ruediger,3500,"Applegate, OR",Applegate Valley OHV Monitoring Project,4431.0,applegate valley ohv monitoring project,True,False,successful,https://www.kickstarter.com/projects/1273847070/applegate-valley-ohv-monitoring-project?ref=discovery_category_newest,4431.0,71,30,30
21,performance of the glorious lauda per la nativit del signore for soloists chorus woodwind ensemble  piano on december 16  2012,Classical Music,the United States,Musica Vitale,2000,"San Diego, CA","Musica Vitale:Respighi's""Lauda per la Natività del Signore",2040.0,musica vitale lauda per la nativita del signore,True,False,successful,https://www.kickstarter.com/projects/361900906/musica-vitale-lauda-per-la-nativita-del-signore?ref=discovery_category_newest,2040.0,14,14,14
7,suite rose is solo etudes for clarinet by cyrille rose with a 2nd clarinet part composed by wesley hall,Classical Music,the United States,Wesley Hall,3250,"Feasterville, PA",Suite Rose no. 3,200.0,suite rose no 3,False,False,failed,https://www.kickstarter.com/projects/1830132012/suite-rose-no-3?ref=discovery_category_newest,200.0,6,30,30
63,with the dna of old school vegas culture we created el retro as a tribute to the land of 1 cocktails and 5 blackjack printed  uspcc,Playing Cards,the United States,Derek McKee,3000,"Los Angeles, CA",El Retro Playing Cards,3401.0,el retro playing cards,True,False,successful,https://www.kickstarter.com/projects/pim/el-retro-playing-cards?ref=discovery_category_newest,3401.0,58,30,30
2,a challenge to the tradition of the prescription pad with a pen palstyle project designed for sharing life lessons  words of wisdom,Print,the United States,Bradley Demeter,350,"Boston, MA",Life Prescriptions (Canceled),49.0,life prescriptions,False,False,canceled,https://www.kickstarter.com/projects/2012794136/life-prescriptions?ref=discovery_category_newest,49.0,34,30,30
299,debut ep for power metal band planeswalker based on the popular card game magic the gathering,Metal,the United States,Jason Ashcraft,4500,"Sacramento, CA",Planeswalker debut EP: Tales of Magic,13090.0,planeswalker debut ep tales of magic,True,True,successful,https://www.kickstarter.com/projects/jashcrafthpdp/planeswalker-debut-ep-tales-of-magic?ref=discovery_category_newest,13090.0,58,29,29
1,pans and hands some buckets and sluice a glimpse of a handminers life and the challenges of everyday offgrid survival,Photo,the United States,Jack Oconnell,25000,"Sacramento, CA","Pans and Hands, documenting a by hand gold mining season. (Canceled)",1.0,pans and hands documenting a by hand gold mining s,False,False,canceled,https://www.kickstarter.com/projects/295036078/pans-and-hands-documenting-a-by-hand-gold-mining-s?ref=discovery_category_newest,1.0,4,30,21
83,in 2020 alt in philly is conservative if you think voices outside mainstream media matterespecially conservativepw is there,Web,the United States,Ed Lynes,5900,"Philadelphia, PA",AltPhilly: Imagine Alt Journalism That's Conservative,6293.64,altphilly imagine alt journalism thats conservative,True,False,successful,https://www.kickstarter.com/projects/altphilly/altphilly-imagine-alt-journalism-thats-conservative?ref=discovery_category_newest,6293.64,6,29,29
23,a giant album of folk music arranged lovingly by the woodsheep,Country & Folk,the United States,The Woodsheep,300,"Morehead, KY",Old Time Pigeon,729.0,old time pigeon,True,False,successful,https://www.kickstarter.com/projects/thewoodsheep/old-time-pigeon?ref=discovery_category_newest,729.0,8,30,30
100,help make this street performer/princeton students debut album a reality,Country & Folk,the United States,Drew Page Music,4000,"Princeton, NJ",Drew Page's debut EP!,6263.5,drew pages debut ep,True,False,successful,https://www.kickstarter.com/projects/drewpagemusic/drew-pages-debut-ep?ref=discovery_category_newest,6263.5,39,30,30
4622,become the most notorious sky captain by harnessing the wind hunting leviathans and plundering opponents,Tabletop Games,the United States,El Dorado Games,50000,"Winneconne, WI",Windward (Expansion & Big Box),292297.0,windward treacherous skies expansion,True,False,successful,https://www.kickstarter.com/projects/eldoradogames/windward-treacherous-skies-expansion?ref=discovery_category_newest,292297.0,60,26,26
237,red baraat trumpeter/singer reimagines sikh kirtan with boundarydefying music to uplift  ignite,World Music,the United States,Sonny Singh,13000,"Brooklyn, NY",Chardi Kala: Sonny Singh’s Debut Album,15574.31,chardi kala sonny singhs debut album,True,False,successful,https://www.kickstarter.com/projects/sonnysingh/chardi-kala-sonny-singhs-debut-album?ref=discovery_category_newest,15574.31,171,56,56
105,a huge thank you to all my supporters for helping fund my new fulllength album and music video i greatly appreciate any donation,Country & Folk,the United States,Millie Mason,6000,"Los Angeles, CA",Millie Mason Full-length Album + Music Video,6085.0,millie mason full length album music video,True,False,successful,https://www.kickstarter.com/projects/846243795/millie-mason-full-length-album-music-video?ref=discovery_category_newest,6085.0,0,45,45
212,a heavy metal dwarven dungeon adventure to steal your soul powered by old school essentials,Tabletop Games,the United States,Drew Cochran,1300,"Rochester, NY",Harrowings #03: MUSPELHELL,5206.0,harrowings 03 muspelhell,True,False,successful,https://www.kickstarter.com/projects/drewcifer/harrowings-03-muspelhell?ref=discovery_category_newest,5206.0,38,14,14
0,im writing a book of memoirs about my crazy life a la david sedaris style its funny sad brutally honest and all entirely true,Print,the United States,Sasha Falkowski,10000,"Hopewell, NJ",I'm Not As Crazy As I Think I Am,0.0,im not as crazy as i think i am,False,False,failed,https://www.kickstarter.com/projects/620730754/im-not-as-crazy-as-i-think-i-am?ref=discovery_category_newest,0.0,0,43,43
3,untold stories to assist with daily motivation to conquering goals,Print,the United States,Tyrell Morant,1500,"Brooklyn, NY",How Did We Get Here,12.0,how did we get here 1,False,False,failed,https://www.kickstarter.com/projects/mrturnup/how-did-we-get-here-1?ref=discovery_category_newest,12.0,8,30,30
1002,a fun lightweight tabletop roleplaying game of exploring dungeons finding treasures and collecting grievous wounds,Tabletop Games,the United States,Shoeless Pete Games,7800,"Seattle, WA",The Well Roleplaying Game,33891.0,the well roleplaying game,True,False,successful,https://www.kickstarter.com/projects/shoelesspetegames/the-well-roleplaying-game?ref=discovery_category_newest,33891.0,55,30,30
1,atypical podcast we are two guys that like to voice our opinion on any and all issues we are former military and combat veterans,Comedy,the United States,Kuzz & Tex C,1000,"Frederick, MD",Conformity Antidote Podcast,25.0,conformity antidote podcast,False,False,failed,https://www.kickstarter.com/projects/1569909283/conformity-antidote-podcast?ref=discovery_category_newest,25.0,6,30,30
0,being a big dude in a little world is tough so weve created an online community providing news and advice for big dudes everywhere,Web,the United States,"Big Dude, Little World",5000,"Denver, CO","Big Dude, Little World",0.0,big dude little world,False,False,failed,https://www.kickstarter.com/projects/bigdudelittleworld/big-dude-little-world?ref=discovery_category_newest,0.0,54,60,60
47,a surreal journey through a strange yet beautiful underworld,Video Games,the United States,Andreas Dilling,1200,"Mount Pleasant, SC",Beyond The Underworld - A Surreal Journey style game,1217.0,beyond the underworld a surreal journey style game,True,True,successful,https://www.kickstarter.com/projects/peacock-games/beyond-the-underworld-a-surreal-journey-style-game?ref=discovery_category_newest,1217.0,2,30,30
2,the second full album of the music project within the realm is complete and ready to be produced onto cd and digital form,Electronic Music,the United States,Bobby Wehner,500,"Mount Joy, PA",Nocturne - A new album by Within The Realm,100.0,nocturne a new album by within the realm,False,False,failed,https://www.kickstarter.com/projects/827000401/nocturne-a-new-album-by-within-the-realm?ref=discovery_category_newest,100.0,48,30,30
392,a podcast about journalism with a purpose well tell stories of journalists who have stood up for justice and resisted objectivity,Audio,the United States,Lewis Wallace,6600,"Durham, NC",The View From Somewhere Podcast: Let's get to $16K!,16635.0,the view from somewhere podcast,True,True,successful,https://www.kickstarter.com/projects/lewispants/the-view-from-somewhere-podcast?ref=discovery_category_newest,16635.0,7,30,30
60,season 3 of empresarios con pablo tirado the official podcast of startups of puerto rico,Journalism,the United States,Pablo Tirado,5000,"San Juan, Puerto Rico",Empresarios con Pablo Tirado Season 3,5716.19,empresarios con pablo tirado season 3,True,True,successful,https://www.kickstarter.com/projects/2061916005/empresarios-con-pablo-tirado-season-3?ref=discovery_category_newest,5716.19,31,20,20
68,i have some stories to tell and i want my friends to help me tell them well you guys wanna help me make a record,Country & Folk,the United States,Mark Currey,3500,"Little Rock, AR",Mark Currey's First Solo Recording!,4832.0,mark curreys first solo recording,True,False,successful,https://www.kickstarter.com/projects/1096119787/mark-curreys-first-solo-recording?ref=discovery_category_newest,4832.0,5,30,30
92,in april of 2011 i will be recording an album produced by dave macisaac at the celtic music centre in judique nova scotia,Classical Music,the United States,Douglas Lamey,5000,"Judique, Canada",Doug Lamey's Upcoming Album,5418.0,doug lameys upcoming album,True,False,successful,https://www.kickstarter.com/projects/douglamey/doug-lameys-upcoming-album?ref=discovery_category_newest,5418.0,127,40,40
70,this kickstarter will help fund an ep recorded in portland or by singer/songwriter holly ann,Music,the United States,Holly Winchell,2000,"Portland, OR",Holly Ann: After All of This Time EP,2748.0,holly ann after all of this time ep,True,False,successful,https://www.kickstarter.com/projects/hollyannmusic/holly-ann-after-all-of-this-time-ep?ref=discovery_category_newest,2748.0,0,15,15
247,a side scrolling platformer with a powerful level editor create share and play a multiverse of games,Video Games,the United States,RobotLovesKitty,5000,"Little Falls, NY",Super Tony Land - Create and Share Levels,7311.0,super tony land create and share levels,True,True,successful,https://www.kickstarter.com/projects/robotloveskitty/super-tony-land-create-and-share-levels?ref=discovery_category_newest,7311.0,42,29,29
20,grammy winner jeffrey holmes has composed a new piece for the umass trumpet studio for the national trumpet competition,Classical Music,the United States,Steven Bailey,1000,"Amherst, MA",Seven's Realm Ensemble at the National Trumpet Competition,1080.0,sevens realm ensemble at the national trumpet comp,True,False,successful,https://www.kickstarter.com/projects/1751749562/sevens-realm-ensemble-at-the-national-trumpet-comp?ref=discovery_category_newest,1080.0,1,24,24
124,kickstart the new colundi album released as a piece of land that we can all share,Electronic Music,the United States,James E. Thomas,30000,"Cornwall and Isles of Scilly, UK",The colundi Sequence (Level 9) – colundi everyOne,4606.3,the colundi sequence level 9 colundi everyone,False,False,failed,https://www.kickstarter.com/projects/watmmofficial/the-colundi-sequence-level-9-colundi-everyone?ref=discovery_category_newest,4606.3,2,12,12
23,im trying to record an album with a full band of studio musicians in nashville i need your help in order to pay for it all,Country & Folk,the United States,Drake Aaron King,2000,"Chickasha, OK",Help Drake King record an album in Nashville!,2000.0,help drake king record an album in nashville,True,False,successful,https://www.kickstarter.com/projects/1300882249/help-drake-king-record-an-album-in-nashville?ref=discovery_category_newest,2000.0,9,30,30
70,a satirical deck of cards honoring the first officials to leave office since the trump presidency began,Playing Cards,the United States,Liz Ziser,5000,"New York, NY",★ Trumped Up Playing Cards ★ Make America Play Again!,5080.0,trumped up playing cards make america play again,True,False,successful,https://www.kickstarter.com/projects/622377239/trumped-up-playing-cards-make-america-play-again?ref=discovery_category_newest,5080.0,24,33,33
7,i have used up my 3 hours of free uploads from soundcloud i need 6 bucks to get 1 month of soundcloud pro,Audio,the United States,Riley Moore,6,"Swannanoa, NC",Cereals Season 2,32.0,cereals season 2,True,False,successful,https://www.kickstarter.com/projects/1583104999/cereals-season-2?ref=discovery_category_newest,32.0,28,15,15
1,the gap is a short book describing the missing link in many human lives and relationships and the typical ways people try to fill it,Print,the United States,Shasta Palmer,100,"Atascadero, CA",The Gap - The Missing Link in Human Relationships,25.0,the gap the missing link in human relationships,False,False,failed,https://www.kickstarter.com/projects/1560055297/the-gap-the-missing-link-in-human-relationships?ref=discovery_category_newest,25.0,1,7,7
35,for over 20 years i have joked around about not having kids and reason 4729 not to have kids when i see a meme or funny video,Print,the United States,Heather A Stafford,1750,"Atlanta, GA",A funny gift book about reasons not to have kids,1750.0,a funny gift book about reasons not to have kids,True,False,successful,https://www.kickstarter.com/projects/1438893751/a-funny-gift-book-about-reasons-not-to-have-kids?ref=discovery_category_newest,1750.0,3,30,30
52,baritone jesse blumberg  pianist martin katz will perform schuberts two seminal song cycles at the 2012 collaborative works festival,Classical Music,the United States,Shannon McGinnis,10000,"Chicago, IL",2012 COLLABORATIVE WORKS FESTIVAL - EPIC JOURNEYS,10090.0,2012 collaborative works festival epic journeys,True,False,successful,https://www.kickstarter.com/projects/1301876439/2012-collaborative-works-festival-epic-journeys?ref=discovery_category_newest,10090.0,14,31,31
2,a prowrestling video podcast that will explore the good old days of the original ecw and broadcast it to the world,Video,the United States,Shun,1000,"Erie, PA",Video Podcast,20.0,video podcast,False,False,failed,https://www.kickstarter.com/projects/1655821900/video-podcast?ref=discovery_category_newest,20.0,6,30,30
41,millennial chamber players is a newlyformed chicagobased ensemble that would love your help in funding our debut concert,Classical Music,the United States,Millennial Chamber Players,2500,"Chicago, IL",Millennial Chamber Players: Debut Concert,2685.0,millennial chamber players debut concert,True,False,successful,https://www.kickstarter.com/projects/millennialchamber/millennial-chamber-players-debut-concert?ref=discovery_category_newest,2685.0,25,32,32
334,14 days only a luxurious carbon master series edition of the legendary viral playing cards used on youtube is here,Playing Cards,the United States,Handlordz LLC,1000,"Fort Worth, TX",Chrome Kings Carbon - MASTER SERIES,16343.0,chrome kings carbon master series,True,False,successful,https://www.kickstarter.com/projects/falconsred/chrome-kings-carbon-master-series?ref=discovery_category_newest,16343.0,20,14,14
400,the endlessly playable monsterhunting solitaire card game,Tabletop Games,the United States,Brian Garber,6000,"Cincinnati, OH",Puzzle Dungeon Deluxe Edition Reprint,21665.0,puzzle dungeon deluxe edition reprint,True,False,successful,https://www.kickstarter.com/projects/puzzledungeon/puzzle-dungeon-deluxe-edition-reprint?ref=discovery_category_newest,21665.0,16,20,20
438,we want to create a limited physical collectors edition package for the seven days visual novel by life0 and fruitbat factory,Video Games,the United States,Fruitbat Factory,20000,"Tokyo, Japan",Seven Days: A Haunting Collector's Edition,34323.0,seven days a haunting collectors edition,True,False,successful,https://www.kickstarter.com/projects/fruitbatfactory/seven-days-a-haunting-collectors-edition?ref=discovery_category_newest,34323.0,87,28,28
