backers_count,blurb,category,country_displayable_name,creator,goal,location,name,pledged,slug,spotlight,staff_pick,state,urls,usd_pledged,preview_time,fundraising_time,state_change
91,a virtual platform to continue our mission of providing a stage for emerging arts,Music,the United States,The Footlight Bar,5000,"Ridgewood, NY",Footlighter TV (FLTV): The Footlight Virtual Stage,5842.0,footlighter tv fltv the footlight virtual stage,True,True,successful,https://www.kickstarter.com/projects/footlightertv/footlighter-tv-fltv-the-footlight-virtual-stage?ref=discovery_category_newest,5842.0,53,28,28
2,coffee talks a youtube channel hosted by two best friends with two opposite personalities,Video,the United States,megan,1000,"Edinburg, TX",Coffee Talks,2.0,coffee talks,False,False,failed,https://www.kickstarter.com/projects/coffeetalks/coffee-talks?ref=discovery_category_newest,2.0,5,60,60
1,help support a brandnew concerto for percussion and wind ensemble to be premiered by mark shimazu,Classical Music,the United States,Josh Trentadue,300,"Brooklyn, NY",CONSORTIUM: Concerto for Percussion and Wind Ensemble (2019),1.0,consortium concerto for percussion and wind ensemb,False,False,failed,https://www.kickstarter.com/projects/trentaduemotif/consortium-concerto-for-percussion-and-wind-ensemb?ref=discovery_category_newest,1.0,7,60,60
1,hardstyle ep needs to be finished within certain time limits in order to send to the proper labels dates in june  july,Electronic Music,the United States,Jeffopolis (deleted),1400,"San Diego, CA",Hardstyle EP,20.0,hardstyle ep,False,False,failed,https://www.kickstarter.com/projects/219059200/hardstyle-ep?ref=discovery_category_newest,20.0,6,52,52
29,designed for bmcs this card game is easy to pick up and can be played for bets or fun,Playing Cards,the United States,David Daggər Powers,250,"Portland, OR",Yekket: A Simple Monster Card Game,765.0,yekket a simple monster card game,True,False,successful,https://www.kickstarter.com/projects/610815524/yekket-a-simple-monster-card-game?ref=discovery_category_newest,765.0,1,30,30
417,a die drafting/worker placement/engine building game for 2 to 5 players set in the golden age of stage magic,Tabletop Games,the United States,Joe Magic Games,16625,"Idaho Falls, ID",Levitation! - Masters of Magic,20443.0,levitation masters of magic 0,True,False,successful,https://www.kickstarter.com/projects/levitation-masters/levitation-masters-of-magic-0?ref=discovery_category_newest,20443.0,72,29,29
10,while fighting thyroid cancer boa foreclosed on us illegallyhelp us with lawyer fees to expose them in court  others going through it,Web,the United States,Jamie Vos,5000,"Buckley, WA",Beating Bank of America,130.0,beating bank of america,False,False,failed,https://www.kickstarter.com/projects/397267214/beating-bank-of-america?ref=discovery_category_newest,130.0,8,30,30
52,a fulllength album of instrumental fingerstyle guitar arrangements of popular love songs released on spotify itunes and more,Music,the United States,Moses Lin,3000,"Orange, CA",Moses Lin - Fingerstyle Guitar Album,3446.0,moses lin fingerstyle guitar album,True,False,successful,https://www.kickstarter.com/projects/moseslinmusic/moses-lin-fingerstyle-guitar-album?ref=discovery_category_newest,3446.0,8,30,30
142,rock the roc is a tribute concert for charlotte figi and the movement she inspired,Music,the United States,Realm of Caring,50000,"Colorado Springs, CO",Rock The RoC,18480.0,rock the roc,False,False,live,https://www.kickstarter.com/projects/rocktheroc/rock-the-roc?ref=discovery_category_newest,18480.0,14,48,0
541,an action platformer with sizechanging mechanics be quick and nimble or large and incharge,Video Games,the United States,Eggo,3000,"Milwaukee, WI",Tribal Hunter: A Beat-Em-Up Action Platformer,26897.0,tribal hunter a beat em up action platformer,True,False,successful,https://www.kickstarter.com/projects/1235129772/tribal-hunter-a-beat-em-up-action-platformer?ref=discovery_category_newest,26897.0,5,30,30
107,trade winds ensemble will lead music workshops in haiti this june partnering with blume haiti and the cemuchca music institute,Classical Music,the United States,Midori Samson,4000,"Cap-Haïtien, Haiti",Trade Winds Ensemble in Haiti,5535.61,trade winds ensemble in haiti,True,False,successful,https://www.kickstarter.com/projects/632407800/trade-winds-ensemble-in-haiti?ref=discovery_category_newest,5535.61,44,30,30
1,the quarterback equalizer app teaches football players specifically quarterbacks their position in a fun and cognitive way,Mobile Games,the United States,John Tomlinson,12000,"Dallas, TX",Quarterback Equalizer App 2.0,1.0,quarterback equalizer app 20,False,False,failed,https://www.kickstarter.com/projects/qbequalizer/quarterback-equalizer-app-20?ref=discovery_category_newest,1.0,17,45,45
42,back from our tour and super excited to finish recording our debut album but we need your help,Country & Folk,the United States,Trent Hancock,7777,"San Diego, CA",The Western Collective Quickstarter,7845.0,the western collective quickstarter,True,False,successful,https://www.kickstarter.com/projects/911966642/the-western-collective-quickstarter?ref=discovery_category_newest,7845.0,0,14,14
150,pens plus pals facilitates and celebrates modernday letter writing by matching aspiring pen pals across generations and geographies,Journalism,the United States,Kate Dobie,6000,"New York, NY",Pens Plus Pals: A Modern Matching Service for Pen Pals,9133.0,pens plus pals a modern matching service for pen p,True,True,successful,https://www.kickstarter.com/projects/884876207/pens-plus-pals-a-modern-matching-service-for-pen-p?ref=discovery_category_newest,9133.0,23,30,30
8,an uncensored internet radio show including a fan website and blog  it will be geared toward fans of the boston bruins  we,Audio,the United States,Glenn Carey,1500,"Phoenix, AZ",Bruins Uncensored Radio Show,490.0,bruins uncensored radio show,False,False,failed,https://www.kickstarter.com/projects/2130769226/bruins-uncensored-radio-show?ref=discovery_category_newest,490.0,6,46,46
65,who are the legends is a fastpaced competitive educational card game not just for kids but for all ages,Tabletop Games,the United States,PEPALWORKS LLC,1400,"Hyderabad, India",Who are the legends,2322.0,who are the legends,True,False,successful,https://www.kickstarter.com/projects/ashritha/who-are-the-legends?ref=discovery_category_newest,2322.0,26,30,30
87,take a guy from chicagos south side thats played with the masters add a band thats done the same and what do you get good music,Blues,the United States,jeff dale,6500,"Los Angeles, CA",You want Good Music and Jeff Dale got it for ya!,7383.86,you want good music and jeff dale got it for ya,True,False,successful,https://www.kickstarter.com/projects/1986105834/you-want-good-music-and-jeff-dale-got-it-for-ya?ref=discovery_category_newest,7383.86,14,30,30
29,8limbsus records my experiences as a female training in muay thai in thailand for a year  serves as a nexus for female mt in general,Journalism,the United States,Sylvie,600,"Chiang Mai, Thailand",8Limbs.Us: Founding a Female Muay Thai Website and Blog,3013.0,8limbsus founding my female muay thai website and,True,False,successful,https://www.kickstarter.com/projects/249764330/8limbsus-founding-my-female-muay-thai-website-and?ref=discovery_category_newest,3013.0,27,30,30
49,the project is to fund my audition tour in europe during the summer of 2013,Classical Music,the United States,Igor Vieira,3800,"San Francisco, CA",Igor's European Audition Tour,4250.0,igors european audition tour,True,False,successful,https://www.kickstarter.com/projects/1108099626/igors-european-audition-tour?ref=discovery_category_newest,4250.0,314,59,59
4,selfpublishing costs can be pricey please help me make this dream a reality for a book about beer and yoga,Print,the United States,Adrienne J Rinaldi,1000,"Denver, CO",Brew & Asana book publishing,136.0,brew and asana book publishing,False,False,failed,https://www.kickstarter.com/projects/230431798/brew-and-asana-book-publishing?ref=discovery_category_newest,136.0,6,23,23
256,tina  her pony creates a new album in 2017 called champion dedicated to brad collins  recorded at echo mountain asheville,Country & Folk,the United States,Tina & Her Pony,15000,"Asheville, NC","Tina & Her Pony's New Record ""Champion"" 2017",15973.0,tina and her ponys new record champion 2017,True,False,successful,https://www.kickstarter.com/projects/tinaandherpony/tina-and-her-ponys-new-record-champion-2017?ref=discovery_category_newest,15973.0,125,30,30
30,the other side of nashville is an illustrated history and discography of the nashville rock underground circa 1976 to 2006,Journalism,the United States,Keith A. Gordon,1250,"Buffalo, NY",Another Other Side of Nashville,1280.0,another other side of nashville,True,False,successful,https://www.kickstarter.com/projects/1372214056/another-other-side-of-nashville?ref=discovery_category_newest,1280.0,0,33,33
3,a forum devoted to offer young guilds old guilds and those not in guilds a place to talk share ideas and help each other,Video Games,the United States,Donald Thomas (deleted),300,"Tulsa, OK",Multi MMO Guild Forum,300.0,multi mmo guild forum,True,False,successful,https://www.kickstarter.com/projects/1775970689/multi-mmo-guild-forum?ref=discovery_category_newest,300.0,2,60,60
4,lets travel write photograph and shoot video of the amazing things and people we see and meet along the way lets shareourjourneys,Web,the United States,Jessie Kwasney,6000,"Baltimore, MD",Share Our Journeys,370.0,share our journeys,False,False,failed,https://www.kickstarter.com/projects/1953364534/share-our-journeys?ref=discovery_category_newest,370.0,2,44,44
195,were looking for folks who are interested in helping to bring our new music into the world,Indie Rock,the United States,Peter Himmelman,20000,"Santa Monica, CA",Press On. The New Recording By Peter Himmelman,21556.0,press on the new recording by peter himmelman,True,False,successful,https://www.kickstarter.com/projects/press-on/press-on-the-new-recording-by-peter-himmelman?ref=discovery_category_newest,21556.0,56,30,30
104,this game has almost everything 30 levels minimalistic graphics simple controls infinite lives and no fun you wont beat it,Video Games,the United States,Derek Henkels,20,"New York, NY",[] this game isn't fun [],349.99,this game isnt fun,True,True,successful,https://www.kickstarter.com/projects/derekhenkels/this-game-isnt-fun?ref=discovery_category_newest,349.99,11,30,30
589,fully custom playing card deck celebrating the united states army printed by the us playing card company design by jackson robinson,Playing Cards,the United States,Jackson Robinson,9500,"Bartlett, TN",US ARMY Playing Cards by Jackson Robinson,21692.0,us army playing cards by jackson robinson,True,False,successful,https://www.kickstarter.com/projects/kingswildproject/us-army-playing-cards-by-jackson-robinson?ref=discovery_category_newest,21692.0,17,20,20
6,a videojournalism program for local high school juniors and seniors interested in the field of reporting and video producing,Journalism,the United States,Charles Cornacchio,25000,"Hopewell Junction, NY",Jr. Journalist Program,261.0,jr journalist program,False,False,failed,https://www.kickstarter.com/projects/2000159057/jr-journalist-program?ref=discovery_category_newest,261.0,12,31,31
278,fiz is a 16bit style singleplayer brewery management simulation game make and market your own beer and grow your brewery,Mobile Games,the United States,Bit By Bit Studios,7500,"Eugene, OR",Fiz: The Brewery Management Game,8791.0,fiz the brewery management game,True,False,successful,https://www.kickstarter.com/projects/bitbybitstudios/fiz-the-brewery-management-game?ref=discovery_category_newest,8791.0,31,30,30
276,decked out cards  eight high studios present benchmark playing cards printed by uspcc  fulfilled via gamblers warehouse,Playing Cards,the United States,Lou Tolentino,7500,"Los Angeles, CA",Benchmark Playing Cards,20987.0,benchmark playing cards,True,False,successful,https://www.kickstarter.com/projects/benchmarkplayingcard/benchmark-playing-cards?ref=discovery_category_newest,20987.0,150,31,31
44,fund recordings of 4 new works,Classical Music,the United States,Boris Skalsky,3800,"New York, NY",Boris Skalsky: New Recordings,4515.0,boris skalsky new recordings,True,False,successful,https://www.kickstarter.com/projects/1948275724/boris-skalsky-new-recordings?ref=discovery_category_newest,4515.0,147,30,30
133,since 06 the annual this is hardcore fest has embodied the true diy spirit of hardcore we want to produce a photobook of our journey,Journalism,the United States,This Is Hardcore,15000,"Philadelphia, PA",This Is Hardcore: Evolution Through Photo,18971.0,this is hardcore evolution through photo,True,False,successful,https://www.kickstarter.com/projects/thisishardcore/this-is-hardcore-evolution-through-photo?ref=discovery_category_newest,18971.0,77,35,35
7,new heights magazines first issue highlighting young creators and inspiring artists by focusing on our mission us,Print,the United States,New Heights Magazine,1000,"Boston, MA",New Heights Magazine - Issue 001: Us,409.0,new heights magazine issue 001 us,False,False,failed,https://www.kickstarter.com/projects/newheightsmagazine/new-heights-magazine-issue-001-us?ref=discovery_category_newest,409.0,1,15,15
40,songs of prayer for this time and for this place we call home,Faith,the United States,City Psalms,4000,"Tucson, AZ",City Psalms Four: Songs Inspired By Our Hometown,4601.0,city psalms four songs inspired by our hometown,True,False,successful,https://www.kickstarter.com/projects/citypsalms/city-psalms-four-songs-inspired-by-our-hometown?ref=discovery_category_newest,4601.0,26,42,42
7,district 12 maybe but the world needs to know what life is really like for the people of appalachia to help bring this region up,Photo,the United States,kyrie,2500,"Van Lear, KY",It's not the Beverly Hillbillies: How Appalachia Really is,83.5,its not the beverly hillbillies how appalachia rea,False,False,failed,https://www.kickstarter.com/projects/1801268209/its-not-the-beverly-hillbillies-how-appalachia-rea?ref=discovery_category_newest,83.5,5,45,45
39,were a music workshop inspiring young musicians to push themselves to envision and then reach for the stars,Kids,the United States,Rising Star Music Workshop,2800,"Jersey City, NJ",Rising Star Music Workshop - an original music experience,2938.11,rising star music workshop an original music experience,True,True,successful,https://www.kickstarter.com/projects/rsmw/rising-star-music-workshop-an-original-music-experience?ref=discovery_category_newest,2938.11,27,19,19
1,create a wonderful world amoung pets become number one in social media make your pet the famous one,Mobile Games,the United States,Saidikrom Al,20000,"Estes, CO",Brand new Social Media,1.0,brand new social media,False,False,failed,https://www.kickstarter.com/projects/petland/brand-new-social-media?ref=discovery_category_newest,1.0,4,60,60
57,a totally adorable original card game full of epic cuteness for 24 players,Tabletop Games,the United States,Joshua Mason,1000,"Chicago, IL",The Kingdom of Cuteopia,3454.0,the kingdom of cuteopia,False,False,live,https://www.kickstarter.com/projects/joshuamason/the-kingdom-of-cuteopia?ref=discovery_category_newest,3454.0,12,9,0
143,explore the world of numerous board games through a single smart board,Tabletop Games,the United States,Mundus,10000,"Zagreb, Croatia",Mundus - A Smart Console for Board Games,19390.0,mundus worlds smartest board game,True,True,successful,https://www.kickstarter.com/projects/mundus/mundus-worlds-smartest-board-game?ref=discovery_category_newest,19390.0,617,60,60
64,the international conductors festival helps emerging orchestra conductors gain valuable performance experiences,Classical Music,the United States,The International Conductors' Festival,3400,"Kiev, Ukraine",The International Conductors' Festival - 2013,3790.0,the international conductors festival 2013 0,True,False,successful,https://www.kickstarter.com/projects/icf3500/the-international-conductors-festival-2013-0?ref=discovery_category_newest,3790.0,1,36,36
1,youtube show about stupid things we care about way too much such as pc builds  video games and wrestling shut up we love it enjo,Video,the United States,Brandon Holtz,12000,"Minneapolis, MN",Gimme Tech! Weekly Geek Show,10.0,gimme tech weekly geek show,False,False,failed,https://www.kickstarter.com/projects/725659635/gimme-tech-weekly-geek-show?ref=discovery_category_newest,10.0,0,30,30
263,the puppet makes a good point an artists career is built upon the ongoing support of people like you lowland hum is no exception,Country & Folk,the United States,Daniel Levi Goans,15000,"Charlottesville, VA",Glyphonic: Lowland Hum's Fourth Album,17744.0,glyphonic lowland hums fourth album,True,True,successful,https://www.kickstarter.com/projects/daniellevigoans/glyphonic-lowland-hums-fourth-album?ref=discovery_category_newest,17744.0,32,30,30
87,tri wing is an online realtime action and grid based card game for pc and mobile,Video Games,the United States,Vincent Veak,3000,"Cincinnati, OH",Tri Wing - A Real Time Action/Grid Based Card Game,3288.0,tri wing a real time action grid based card game,True,False,successful,https://www.kickstarter.com/projects/veakxp/tri-wing-a-real-time-action-grid-based-card-game?ref=discovery_category_newest,3288.0,677,30,30
21,brobash to give back to our supporters,World Music,the United States,Anthony Urban,1000,"Vandalia, MI","Bros, Buds, & Brews",1224.0,bros buds and brews,True,False,successful,https://www.kickstarter.com/projects/urbangameing/bros-buds-and-brews?ref=discovery_category_newest,1224.0,3,28,28
32,a 25d platformer about a child and their emotions,Video Games,the United States,First Light Studio,2390,"San Jose, CA",Bata,2031.0,bata,False,False,live,https://www.kickstarter.com/projects/bata/bata?ref=discovery_category_newest,2031.0,29,29,0
91,resin dice with a unique logo for each class on the nat 20,Tabletop Games,the United States,Christina Moseley Pinckard,5300,"Haughton, LA",Choose your Class Dice,1692.0,chose your class dice,False,False,live,https://www.kickstarter.com/projects/rpgdice/chose-your-class-dice?ref=discovery_category_newest,1692.0,5,29,0
143,"settle   to make or arrange for a final dispositionr
score    a written form of a musical composition",Country & Folk,the United States,Grant Peeples and the Peeples Republik,11111,"Tallahassee, FL",Settling Scores Vol. II,11670.11,settling scores vol ii,True,False,successful,https://www.kickstarter.com/projects/grantpeeples/settling-scores-vol-ii?ref=discovery_category_newest,11670.11,17,30,30
344,a dice rolling realtime crossword building and opponenthustling game strategically form words like youve never done before,Tabletop Games,the United States,Lori Cavell Love,4175,"Washington, DC",Word Hustle: A Strategic Game of Crosswords,12755.0,word hustle a strategic game of crosswords,True,False,successful,https://www.kickstarter.com/projects/wordhustle/word-hustle-a-strategic-game-of-crosswords?ref=discovery_category_newest,12755.0,84,30,30
796,please help us record and promote our first fulllength album,Country & Folk,the United States,Mouths of Babes,35000,"Atlanta, GA",MOUTHS OF BABES: First Full-Length Album!,56110.0,mouths of babes first full length album,True,True,successful,https://www.kickstarter.com/projects/mouthsofbabes/mouths-of-babes-first-full-length-album?ref=discovery_category_newest,56110.0,139,31,31
220,the bird dogs are back baby and we need you to help us record our second full length studio album,Country & Folk,the United States,Laney Lou and the Bird Dogs,22000,"Bozeman, MT",Laney Lou and The Bird Dogs : Studio Album #2,22778.0,laney lou and the bird dogs studio album 2,True,False,successful,https://www.kickstarter.com/projects/thebirddogs/laney-lou-and-the-bird-dogs-studio-album-2?ref=discovery_category_newest,22778.0,8,31,31
68,2 mystical cds that will transport you into a deep state of relaxation featured on a new app to make meditation easy  accessible,Music,the United States,Anisha,3300,"Fort Lauderdale, FL",Mystical Meditation CDs & APP!,3376.0,mystical meditation cds and app,True,True,successful,https://www.kickstarter.com/projects/anisha/mystical-meditation-cds-and-app?ref=discovery_category_newest,3376.0,57,12,12
17,we believe in a modern musical movement we aim to share it all across the globe,Electronic Music,the United States,LYTT (amberLY and maTT),108500,"Los Angeles, CA",LYTT TOUR,192.13,lytt tour,False,False,failed,https://www.kickstarter.com/projects/482954212/lytt-tour?ref=discovery_category_newest,192.13,35,47,47
1159,acting hurt dropping loot giving exp to heroes all in a days work experience the daily adventures of a random encounter monster,Video Games,the United States,Opal Squad,50000,"New Haven, CT",Mediocre Monster - The Life of an RPG Monster,58680.0,mediocre monster the life of an rpg monster,True,True,successful,https://www.kickstarter.com/projects/opalsquad/mediocre-monster-the-life-of-an-rpg-monster?ref=discovery_category_newest,58680.0,39,29,29
8,"loza rose  summer daze music video 
song will drop on 06/21",Electronic Music,the United States,Loza Rose,1800,"Asbury Park, NJ",'Summer Daze' Music Video,128.0,summer daze music video,False,False,failed,https://www.kickstarter.com/projects/lozarose/summer-daze-music-video?ref=discovery_category_newest,128.0,0,52,52
5,win the game by making someone smile,Playing Cards,the United States,SURPRISE SMILE,10,"Portland, OR",SURPRISE SMILE,30.0,surprise smile,True,False,successful,https://www.kickstarter.com/projects/529956802/surprise-smile?ref=discovery_category_newest,30.0,0,30,30
3,to improve the media coverage information provided and support the growth of womens athletics and girls sports programs across the us,Web,the United States,Luis Sanchez,5000,"Boston, MA",MyWSports,225.0,mywsports,False,False,failed,https://www.kickstarter.com/projects/340902026/mywsports?ref=discovery_category_newest,225.0,19,30,30
0,podcast focased on the influence of lgbtq and women in video games and film  discussions and interviews around nerd culture,Audio,the United States,Derek Elizondo & Ashton Gearhart,3300,"Seattle, WA",Respawn cinema podcast,0.0,respawn cinema podcast,False,False,failed,https://www.kickstarter.com/projects/781113973/respawn-cinema-podcast?ref=discovery_category_newest,0.0,0,60,60
23,create the most insane situations in this hilarious inappropriate game of awesomeness its pure nonsense,Playing Cards,the United States,Tyler King,500,"Orem, UT",Nonsense,1253.0,nonsense 2,True,False,successful,https://www.kickstarter.com/projects/1250209156/nonsense-2?ref=discovery_category_newest,1253.0,0,15,15
2,help north carolinas small  family owned businesses recover from boycotts due to hb2,Print,the United States,Nancy Huggins & Bruce Shepherd,10000,"Wilmington, NC",Let's ReVisit NC,6.0,revisit nc,False,False,failed,https://www.kickstarter.com/projects/158043508/revisit-nc?ref=discovery_category_newest,6.0,2,8,8
203,"john williams trumpet concerto
conducted by john williams
soloist thomas hooten
accompanied by full orchestra",Classical Music,the United States,Thomas Hooten,30000,"Los Angeles, CA",John Williams & Thomas Hooten Recording Project,37553.0,john williams and thomas hooten recording project,True,False,successful,https://www.kickstarter.com/projects/williamshootencd/john-williams-and-thomas-hooten-recording-project?ref=discovery_category_newest,37553.0,7,25,25
2527,codex silenda is a five page book that features five intricate puzzles the user must solve each pages puzzle to unlock the next page,Puzzles,the United States,Brady Whitney,30000,"Trumbull, CT",Codex Silenda: The Book of Puzzles,210108.21,codex silenda the book of puzzles,True,True,successful,https://www.kickstarter.com/projects/codexsilenda/codex-silenda-the-book-of-puzzles?ref=discovery_category_newest,210108.21,39,28,28
67,world premiere recording of ned rorems opera our town adapted from the pulitzer prizewinning classic american play by thornton wilder,Classical Music,the United States,Monadnock Music,10000,"Peterborough, NH",Our Town Recording,10003.0,our town recording,True,False,successful,https://www.kickstarter.com/projects/1223531603/our-town-recording?ref=discovery_category_newest,10003.0,3,30,30
147,killer rabbits 2 more medieval manuscript art made into miniatures from skull  crown,Tabletop Games,the United States,Thomas Foss,3000,"San Jose, CA",Killer Rabbits 2: Who letteth the hounds out,11588.0,killer rabbits 2 who letteth the hounds out,True,False,successful,https://www.kickstarter.com/projects/skullandcrown/killer-rabbits-2-who-letteth-the-hounds-out?ref=discovery_category_newest,11588.0,53,25,25
17,hardcore reporting on critical nature conservation stories for this american land on public television stations nationwide,Video,the United States,Gary Strieker,60000,"Denver, CO",Reports from the Edge: Protecting Natural Resources,634.0,reports from the edge protecting natural resources,False,True,failed,https://www.kickstarter.com/projects/161348613/reports-from-the-edge-protecting-natural-resources?ref=discovery_category_newest,634.0,3,30,30
118,invest in the future of journalism   invest in journalism without walls,Journalism,the United States,Ilana Ozernoy,16800,"Lodwar, Kenya",Journalism Without Walls Goes to Kenya,18485.0,journalism without walls goes to kenya,True,False,successful,https://www.kickstarter.com/projects/ozernoy/journalism-without-walls-goes-to-kenya?ref=discovery_category_newest,18485.0,7,30,30
