backers_count,blurb,category,country_displayable_name,creator,goal,location,name,pledged,slug,spotlight,staff_pick,state,urls,usd_pledged,preview_time,fundraising_time,state_change
35,plushie of zuko from avatar the last airbender,Toys,the United States,Mystigrx,3000,"Boulder, CO",Unofficial Zuko Plushie,3010.0,unofficial zuko plushie,True,False,successful,https://www.kickstarter.com/projects/mystigrx/unofficial-zuko-plushie?ref=discovery_category_newest,3010.0,31,30,30
100,a greedy corporate analyst contracts a supernatural contagion that forces him to help others and not earn money for himself,Graphic Novels,the United States,Xane Daniel,5000,"Chicago, IL",Righteous Comic Series Graphic Novels Volumes 1 & 2,5682.0,righteous comic series volume 2 first printing,True,False,successful,https://www.kickstarter.com/projects/kevmo/righteous-comic-series-volume-2-first-printing?ref=discovery_category_newest,5682.0,5,31,31
75,100 needle felted cacti,Knitting,the United States,Brittany,500,"Seattle, WA",Make 100: Needle Felted Cacti,2306.0,make 100 needle felted cacti,True,True,successful,https://www.kickstarter.com/projects/craftyarchaeologist/make-100-needle-felted-cacti?ref=discovery_category_newest,2306.0,4,30,30
128,an effort to create a new worldwide custom black color,Graphic Design,the United States,Nick Black,15000,"New Brunswick, NJ",The New Black.,4164.0,the new black,False,True,failed,https://www.kickstarter.com/projects/1809021552/the-new-black?ref=discovery_category_newest,4164.0,18,33,33
21,beautiful and unique pens handturned using wood acrylic and stone,Woodworking,the United States,Crooked Mill Woodworking,1000,"Mesa, AZ","Handcrafted Pens- Wood, Stone, Acrylic",1579.0,handcrafted pens wood stone acrylic,True,False,successful,https://www.kickstarter.com/projects/944574694/handcrafted-pens-wood-stone-acrylic?ref=discovery_category_newest,1579.0,16,30,30
73,keeps the mess in the box and out of your home,Product Design,the United States,Dan and Kellie Akers,10000,"Silverthorne, CO","The Grate Litter Box, Say Goodbye to Litter Scatter!",11038.0,the grate litter box say goodbye to litter scatter,True,False,successful,https://www.kickstarter.com/projects/cleankitty/the-grate-litter-box-say-goodbye-to-litter-scatter?ref=discovery_category_newest,11038.0,677,28,28
0,i am hosting a donation based leathercraft workshop where ill train youth in hand making leather goods and organizing fashion shows,DIY,the United States,Anthony Grimmett III,200,"Detroit, MI",Leathering the Leaves,0.0,leathering the leaves,False,False,failed,https://www.kickstarter.com/projects/1539010906/leathering-the-leaves?ref=discovery_category_newest,0.0,1,30,30
29,for the price of a dollar i will handwrite a letter in english and send it to anywhere of your choosing,Stationery,the United States,Young Seok 'Kevin' Lee,150,"Berkeley, CA",Letters for Dollars,150.0,letters for dollars,True,False,successful,https://www.kickstarter.com/projects/717328474/letters-for-dollars?ref=discovery_category_newest,150.0,3,39,39
74,a diy face mask design made from stuff around the apartment,Product Design,the United States,Strand Design,20,"Chicago, IL",Pantry Protective Equipment,117.0,pantry protective equipment,True,True,successful,https://www.kickstarter.com/projects/stranddesign/pantry-protective-equipment?ref=discovery_category_newest,117.0,3,30,30
11,long after the end a small town lies in crisis helped by her friend and an unusual bodyguard one girl sets off to save the town,Graphic Novels,the United States,Hannah Rehberger,350,"Menomonie, WI",Rikomenci,372.0,rikomenci,True,False,successful,https://www.kickstarter.com/projects/805169961/rikomenci?ref=discovery_category_newest,372.0,4,14,14
916,third issue of the 1 indy comic by jamie tyndall,Comic Books,the United States,Jamie Tyndall,15000,"St. Louis, MO",White Widow: Deadly Masquerade,57808.0,white widow deadly masquerade,True,False,successful,https://www.kickstarter.com/projects/volume8/white-widow-deadly-masquerade?ref=discovery_category_newest,57808.0,6,10,10
225,series debut of a comic with spaceships aliens the fate of the universe and a family struggling to hold together in the thick of it,Webcomics,the United States,Cody B. Stewart,3000,"Queensbury, NY",The Slip #1: A Sci-Fi Tale of Grief and Interdimensional War,4320.0,the slip 1 a sci fi tale of grief and interdimensi,True,True,successful,https://www.kickstarter.com/projects/124559745/the-slip-1-a-sci-fi-tale-of-grief-and-interdimensi?ref=discovery_category_newest,4320.0,425,30,30
30,jo barrs cult legend comic the crow meets everette hartsoes femme fatale razor in a historic team up of 2 indie comic greats,Graphic Novels,the United States,Evolutionary Comics,1,"Las Vegas, NV",The CROW/RAZOR KILL THE PAIN HARDCOVER director's cut,2045.0,the crow razor kill the pain hardcover directors c,True,False,successful,https://www.kickstarter.com/projects/1655558466/the-crow-razor-kill-the-pain-hardcover-directors-c?ref=discovery_category_newest,2045.0,0,9,9
5,words is a project that showcases the applicability of lyricism in everyday life through engaging minimal posters,Graphic Design,the United States,Austin Dixon,750,"Malibu, CA",words.,215.0,words,False,False,failed,https://www.kickstarter.com/projects/austindixon/words?ref=discovery_category_newest,215.0,6,30,30
109,2 classic graphic novels  exclusive signed/numbered amanda conner  jimmypalmiotti print,Graphic Novels,the United States,PaperFilms,3500,"Clearwater, FL",MAKE 100 - PAINKILLER JANE print & book bundle,4530.0,make 100 painkiller jane signed bundle and exclusive print,True,True,successful,https://www.kickstarter.com/projects/paperfilms/make-100-painkiller-jane-signed-bundle-and-exclusive-print?ref=discovery_category_newest,4530.0,6,15,15
51,a poppy comedy about unhealthy bromances the fighting spirit and a chick who cant seem to leave her reckless martial arts teammates,Webcomics,the United States,Tiffany Pascal,3000,"Roswell, NM",Dear Jiu Jitsu Boyfriends,2289.0,dear jiu jitsu boyfriends,False,True,failed,https://www.kickstarter.com/projects/tiffanypascal/dear-jiu-jitsu-boyfriends?ref=discovery_category_newest,2289.0,23,30,30
126,a manga/comic book with voice over performances manga  audio book,Comic Books,the United States,Blaze Manga,5000,"Houston, TX",Iridescent Volume 1,7355.0,iridescent volume 1,True,True,successful,https://www.kickstarter.com/projects/iridescentmanga/iridescent-volume-1?ref=discovery_category_newest,7355.0,71,60,60
15,are you a relentless note taker list maker inspiration collector or worldrenowned doodler yes you say this is a project for you,Graphic Design,the United States,Out Of The Blue Press,7000,"Austin, TX",Eclectic & Inspirational Journals from a Mother & Son Studio,1100.0,dont quit your day dream a case for journals,False,False,failed,https://www.kickstarter.com/projects/outofthebluepress/dont-quit-your-day-dream-a-case-for-journals?ref=discovery_category_newest,1100.0,7,25,25
98,vcu dance and choreography seniors seeking support to present their capstone projects in a formal concert this april,Performances,the United States,RESIST:VCU Dance Senior Projects 2017,6500,"Richmond, VA",RESIST: VCU Dance Spring Senior Projects 2017,6935.0,resist vcu dance spring senior projects 2017,True,False,successful,https://www.kickstarter.com/projects/1953462717/resist-vcu-dance-spring-senior-projects-2017?ref=discovery_category_newest,6935.0,1,44,44
3,end homelessness in la with a truly sustainable housing solution,Architecture,the United States,Anthony Scheidler,865000,"Los Angeles, CA",Lifebox Home: The End is Here,12.0,lifebox home the end is here,False,False,failed,https://www.kickstarter.com/projects/tonyscheidler/lifebox-home-the-end-is-here?ref=discovery_category_newest,12.0,2,60,60
151,a scifi western about an outlaw turned bounty hunter trying to stop a group of extremists from ruining her town,Comic Books,the United States,Kris Kole,2400,"San Diego, CA","Kris Kole #1: Sci-Fi Western, Outlaw Turned Hero",2483.0,kris kole 1 sci fi western outlaw turned hero,True,True,successful,https://www.kickstarter.com/projects/2068306287/kris-kole-1-sci-fi-western-outlaw-turned-hero?ref=discovery_category_newest,2483.0,3,30,30
35,this is her story is a performance that is sure to captivate and touch hearts of not only women but all audiences,Dance,the United States,MarDelDance,1000,"Norwood, NJ","'This Is Her Story..."" MarDelDance's First TOUR!",1426.0,this is her story mardeldances first tour,True,False,successful,https://www.kickstarter.com/projects/mardeldance/this-is-her-story-mardeldances-first-tour?ref=discovery_category_newest,1426.0,0,60,60
5,these are plushies that i handmade  i have made many characters and original characters,Knitting,the United States,Brittany Carpenter,600,"Tyler, TX",Handmade Plushies (Canceled),212.0,handmade plushies,False,False,canceled,https://www.kickstarter.com/projects/169886997/handmade-plushies?ref=discovery_category_newest,212.0,3,30,29
1,a 1 year monthly subscription that provides customized diaper cakes and baby essentials on a specific date ie 112 months,DIY,the United States,Mya F,25000,"Bloomfield Hills, MI",Baby Cakes Design Co.,1.0,baby cakes design co,False,False,failed,https://www.kickstarter.com/projects/bcdc/baby-cakes-design-co?ref=discovery_category_newest,1.0,3,60,60
100,buscarte searching for you is a multidisciplinary performance  cocreated with the women of mujeres unidas y activas mua,Performances,the United States,Navarrete x Kajiyama Dance Theater,8000,"Oakland, CA",BUSCARTE (Searching for You) with Mujeres Unidas y Activas,8000.0,buscarte searching for you with mujeres unidas y a,True,False,successful,https://www.kickstarter.com/projects/naka/buscarte-searching-for-you-with-mujeres-unidas-y-a?ref=discovery_category_newest,8000.0,1,29,29
148,as we fall reveals the falling of the human intellect when impulsive behavior takes over empathy is lost and we become animals,Performances,the United States,leah verier-dunn,10000,"Sarasota, FL",Moving Ethos Dance: As We Fall,10255.0,moving ethos dance as we fall,True,False,successful,https://www.kickstarter.com/projects/movingethosdance/moving-ethos-dance-as-we-fall?ref=discovery_category_newest,10255.0,0,30,30
0,the yarn vault  the sensible way to protect yarn yarn vault closes around your skein offering 360 of protection without trapping it,Knitting,the United States,"Three Palms Products, LLC",12000,"North Fort Myers, FL",Yarn Protecting Dispenser (Canceled),0.0,yarn protecting dispenser,False,False,canceled,https://www.kickstarter.com/projects/yarnvault/yarn-protecting-dispenser?ref=discovery_category_newest,0.0,0,29,5
98,a dance concert of modern  rhythm tap works by choreographer shirley jenkins,Dance,the United States,Shirley C. Jenkins,8000,"Seattle, WA",DanceJenkinsDance!!!,11420.0,dancejenkinsdance,True,False,successful,https://www.kickstarter.com/projects/57304206/dancejenkinsdance?ref=discovery_category_newest,11420.0,14,43,43
85,mrkumasi 1,Comic Books,the United States,Kojo Aidoo,5000,"West Orange, NJ",Mr.Kumasi #1 The story of the Sun Tanned urban super man,5686.0,mrkumasi 1 the story of the sun tanned urban super man,True,True,successful,https://www.kickstarter.com/projects/kojo973/mrkumasi-1-the-story-of-the-sun-tanned-urban-super-man?ref=discovery_category_newest,5686.0,0,40,40
11,a coffee table to share with your cat,Product Design,the United States,Meow Bloom,3000,"Los Angeles, CA",Cave Cat Table,3501.0,cave cat table,True,False,successful,https://www.kickstarter.com/projects/meowbloom/cave-cat-table?ref=discovery_category_newest,3501.0,91,35,35
632,a collection of covers pinups and sketches by dc harley quinn artist chad hardin,Comic Books,the United States,Chad Hardin,8000,"American Fork, UT",The Art of Chad Hardin 3,41541.0,the art of chad hardin 3,True,True,successful,https://www.kickstarter.com/projects/hellbringers/the-art-of-chad-hardin-3?ref=discovery_category_newest,41541.0,132,30,30
12,learn how to make comics with creator jess smart smiley via skype visits for your class club or group long live comics,Events,the United States,jess smart smiley,5000,"Orem, UT",Let's Make Comics! (Skype Visits) (Canceled),272.0,lets make comics skype visits,False,False,canceled,https://www.kickstarter.com/projects/jess-smart-smiley/lets-make-comics-skype-visits?ref=discovery_category_newest,272.0,31,30,20
2,claim your rightful place to conquer the purgatory and spread stories among warriors a webcomic series based on the readers path,Webcomics,the United States,Fauzan and Korra,500,"Bandung, Indonesia",GOD'S WARRIOR Project,2.0,gods warrior project,False,False,failed,https://www.kickstarter.com/projects/faukk/gods-warrior-project?ref=discovery_category_newest,2.0,6,29,29
7,ellen bartel and amy myers are creating a dance for global water dances a global effort to bring awareness to water issues,Performances,the United States,Ellen Bartel,2800,"Austin, TX",Global Water Dances in Austin TX,206.0,global water dances in austin tx,False,False,failed,https://www.kickstarter.com/projects/1613366929/global-water-dances-in-austin-tx?ref=discovery_category_newest,206.0,8,25,25
20,a series of funny antismoking posters and animations,Graphic Design,the United States,Sam Goin,5000,"Chicago, IL",Cigarettes Kill,1060.0,cigarettes kill,False,False,failed,https://www.kickstarter.com/projects/1173146363/cigarettes-kill?ref=discovery_category_newest,1060.0,25,35,35
604,we want to localize and publish osamu tezukas 2volume series alabaster in english,Graphic Novels,the United States,digitalmanga,29200,"Gardena, CA",Publish Osamu Tezuka's Alabaster Vol.1-2,32304.04,publish osamu tezukas alabaster vol1 2,True,True,successful,https://www.kickstarter.com/projects/digitalmanga/publish-osamu-tezukas-alabaster-vol1-2?ref=discovery_category_newest,32304.04,85,30,30
1,all of your graphic and computing needs in one square up your business with us,Graphic Design,the United States,Terrence Robinson,1000,"Monroe, LA",E-Squared Design Company,5.0,e squared design company,False,False,failed,https://www.kickstarter.com/projects/965694558/e-squared-design-company?ref=discovery_category_newest,5.0,3,32,32
8,this innovative device will make personalizing soap easy and even more fun using recycled fragments or new soap base with any mold,DIY,the United States,E. Jasmine Wardlaw,30000,"Redondo Beach, CA",The Soap Butler Home Soap Making/Recycling System,253.0,the soap butler home soap making recycling system,False,False,failed,https://www.kickstarter.com/projects/thesoapbutler/the-soap-butler-home-soap-making-recycling-system?ref=discovery_category_newest,253.0,410,30,30
636,we train formerly incarcerated people to repurpose discarded materials into home furnishings  incubate them into their own businesses,Woodworking,the United States,Refoundry,45000,"Brooklyn, NY","REFOUNDRY: Restoring Furniture, Restoring Lives",50182.5,refoundry restoring furniture restoring lives,True,True,successful,https://www.kickstarter.com/projects/refoundry/refoundry-restoring-furniture-restoring-lives?ref=discovery_category_newest,50182.5,11,60,60
155,two teens on a postclimateapocalypse earth wield the ancient craft of neuroscience against an oppressive world government,Graphic Novels,the United States,"Danbee ""Tauntaun"" Kim",7640,"London, UK",A sci-fi graphic novel based on real neuroscience,11125.88,a sci fi graphic novel based on real neuroscience,True,False,successful,https://www.kickstarter.com/projects/taunsquared/a-sci-fi-graphic-novel-based-on-real-neuroscience?ref=discovery_category_newest,11125.88,14,45,45
23,"two goddesses a drow assassin and a vengeance trip
a erotic adventure graphic novel  nsfw",Graphic Novels,the United States,Kyle Jacobs [Root.],570,"Eugene, OR",Liberty | Death,656.0,liberty death,True,False,successful,https://www.kickstarter.com/projects/rootdraws/liberty-death?ref=discovery_category_newest,656.0,7,8,8
30,cards that start w/ a lot of love and open to a little hate or vice versa cards your friends or enemies parking cards for idiots too,Printing,the United States,Dave Gadlin,1700,"Portland, OR",Love Hate Mail - Greeting Cards with Love... and Hate!,660.0,love hate mail greeting cards with love and hate,False,False,canceled,https://www.kickstarter.com/projects/1536512884/love-hate-mail-greeting-cards-with-love-and-hate?ref=discovery_category_newest,660.0,31,29,5
41,a performance of french futurism and dadaism at its best multidiscipline collaboration including dance film art and live music,Performances,the United States,Emilie Rupp,3000,"Dallas, TX",Parade 100 Year Anniversary Performance,3165.0,la parade 100 year anniversary performance,True,False,successful,https://www.kickstarter.com/projects/2000822834/la-parade-100-year-anniversary-performance?ref=discovery_category_newest,3165.0,66,18,18
16,whimsical hand carved santa ornaments for your tree,Woodworking,the United States,Frank Hailey III,250,"Farmville, VA",Santa Is Coming To Town!,585.0,santa is coming to town 0,True,False,successful,https://www.kickstarter.com/projects/418548765/santa-is-coming-to-town-0?ref=discovery_category_newest,585.0,9,30,30
111,help me use dance to spread awareness about the hidden dangers of asthma and provide resources to mitigate them,Performances,the United States,Davalois Fearon Dance,20000,"New York, NY",The For C.J. Initiative,20492.0,the for cj initiative,True,True,successful,https://www.kickstarter.com/projects/1101840149/the-for-cj-initiative?ref=discovery_category_newest,20492.0,442,30,30
129,the strange 4 has a few days left please help and support this comic,Comic Books,the United States,John Daniel Taylor IV,2500,"Washington, DC",The Strange #4,3073.0,the strange 4 0,True,False,successful,https://www.kickstarter.com/projects/1582272995/the-strange-4-0?ref=discovery_category_newest,3073.0,6,36,36
1547,a gorgeous 2016 pinup calendar by xin ye marks her return to erfworld backed by eisner nominee lauri ahonen on inks and colors,Webcomics,the United States,Rob Balder,6000,"Richmond, VA",Erfworld: Pin-up Calendar & New Art Team,50298.2,erfworld pin up calendar and new art team,True,False,successful,https://www.kickstarter.com/projects/1554093685/erfworld-pin-up-calendar-and-new-art-team?ref=discovery_category_newest,50298.2,5,22,22
64,marcat dance is creating a new 40minute work to premiere on tour at the renowned jacobs pillow and detroit dance city festival,Performances,the United States,Marcat Dance,8000,"Vilches, Spain",Marcat Dance Creates New Work: INSIDE KID,9135.0,marcat dance creates new work inside kid,True,False,successful,https://www.kickstarter.com/projects/marcatdancecompany/marcat-dance-creates-new-work-inside-kid?ref=discovery_category_newest,9135.0,1,30,30
28,help me finish the print version of comfort travel day one donate to fund printing and spur completion of day two,Graphic Novels,the United States,Theodore Mallison,750,"Akron, OH","Help Me Finish My Graphic Novel, ""Comfort Travel""",1070.0,help me finish my graphic novel comfort travel,True,False,successful,https://www.kickstarter.com/projects/1138046436/help-me-finish-my-graphic-novel-comfort-travel?ref=discovery_category_newest,1070.0,21,30,30
4,happy cups  coming to a party near you help us fund the production and marketing of these happy cups,Printing,the United States,Annie Roche,5000,"Dallas, TX",HAPPY CUPS!  Our cups are always full and HAPPY!,58.0,happy cups our cups are always full and happy,False,False,failed,https://www.kickstarter.com/projects/1741836146/happy-cups-our-cups-are-always-full-and-happy?ref=discovery_category_newest,58.0,3,30,30
95,skyler is a typical teenager with her own list of problems the last thing she needs is a city to defend,Comic Books,the United States,Hyperverse Comics,1000,"Virginia Beach, VA",#fatgirl #1 - CALL ME FATGIRL!!!,2119.0,fangirl 1 call me fan girl,True,False,successful,https://www.kickstarter.com/projects/hyperversecomics/fangirl-1-call-me-fan-girl?ref=discovery_category_newest,2119.0,10,30,30
19,in april 2015 library dances bring sbjhs students and professional dancers together to bring literature to life through dance,Dance,the United States,Cecily Stewart,3000,"Santa Barbara, CA",Library Dances at Santa Barbara Junior High,3260.0,library dances at santa barbara junior high,True,False,successful,https://www.kickstarter.com/projects/293298551/library-dances-at-santa-barbara-junior-high?ref=discovery_category_newest,3260.0,0,18,18
504,a 196page comics anthology celebrating the boys love genre through six original stories,Anthologies,the United States,Eric Alexander Arroyo,9500,"Brooklyn, NY","Boy, I Love You - A Boys' Love Comics Anthology",14978.0,boy i love you a boys love comics anthology,True,True,successful,https://www.kickstarter.com/projects/arroyeah/boy-i-love-you-a-boys-love-comics-anthology?ref=discovery_category_newest,14978.0,38,31,31
2,im building a business that will create handcrafted happiness in the form of yarn,Crochet,the United States,Skyler Garcea,1100,"Mandeville, LA",The Dragons Breath Stitchery,40.0,the dragons breath stitchery,False,False,failed,https://www.kickstarter.com/projects/757969690/the-dragons-breath-stitchery?ref=discovery_category_newest,40.0,0,45,45
28,sandstorm  color coded sanding hand held sanding block designed to use standard 1/2 x 18 sanding belts,Woodworking,the United States,Frank Fox,150,"Greensboro, NC","Sandstorm - Color Coded Sanding, Using 1/2 x 18 inch Belts",1221.0,sandstorm,True,False,successful,https://www.kickstarter.com/projects/frankfox/sandstorm?ref=discovery_category_newest,1221.0,4,17,17
0,house of diamonds is home to richmonds own dancing diamonds competition dance team our girls are confident poised and graceful,Performances,the United States,House of Diamonds Dance Team,500,"Richmond, VA",Help Support House of Diamond's Competition & Studio Fund,0.0,help support house of diamonds competition and stu,False,False,failed,https://www.kickstarter.com/projects/1091491825/help-support-house-of-diamonds-competition-and-stu?ref=discovery_category_newest,0.0,7,30,30
61,at last a book that takes a new approach to teaching knitting that doesnt assume you know more than you might a totally new approach,Knitting,the United States,Sean Riley,3000,"Boston, MA",Knitting Untangled - A Learn to Knit eBook,3205.0,knitting untangled a learn to knit ebook,True,False,successful,https://www.kickstarter.com/projects/444491060/knitting-untangled-a-learn-to-knit-ebook?ref=discovery_category_newest,3205.0,0,29,29
2,i started a candle business and ive been saving up to buy the signature canisters im working 3 jobs and working hard for this,Candles,the United States,Amanda Marten,3000,"Fort Worth, TX",Modern Melts Candle Container Fund!,103.0,modern melts candle container fund,False,False,failed,https://www.kickstarter.com/projects/modernmelts/modern-melts-candle-container-fund?ref=discovery_category_newest,103.0,0,30,30
6,a graphic novel and unique take on anthology horror this volume would tell a single story and introduce its host the gravedigger,Graphic Novels,the United States,Patrick D. Gillespie,11000,"Lacey, WA","Grave Stories: Enter, The Gravedigger",281.0,grave stories enter the gravedigger 0,False,False,live,https://www.kickstarter.com/projects/beng85afictionado/grave-stories-enter-the-gravedigger-0?ref=discovery_category_newest,281.0,81,59,0
12,an amalgam of belly dance fusion hiphop rock alternative and more delivered by beautifully talented performers,Performances,the United States,"Jennifer Trieste, MetalGypsy Productions",2500,"Tampa, FL",MetalGypsy Productions' La Danse du Serpent Show,377.0,metalgypsy productions la danse du serpent show,False,True,failed,https://www.kickstarter.com/projects/metalgypsy/metalgypsy-productions-la-danse-du-serpent-show?ref=discovery_category_newest,377.0,9,30,30
4068,formerly nocternal bts edition of the 1st issue of a new series about humanity trying to survive in everlasting darkness,Comic Books,the United States,Scott Snyder,40000,"Long Island, NY",Scott Snyder & Tony Daniel’s NOCTERRA 1 Collector’s Edition,218380.0,scott snyder and tony daniels nocternal 1 collectors edition,True,True,successful,https://www.kickstarter.com/projects/scottsnyder/scott-snyder-and-tony-daniels-nocternal-1-collectors-edition?ref=discovery_category_newest,218380.0,39,31,31
1987,2 screwdrivers 10 bits for each  builtin storage bin  allmetal integral molding  multifunctional magnetic bits,Product Design,the United States,Imezing,5000,"Los Angeles, CA",Imezing: Built-in Storage Bin Multi-function Screwdriver,101291.0,imezing built in storage bin multi function screwdriver,True,False,successful,https://www.kickstarter.com/projects/imezing/imezing-built-in-storage-bin-multi-function-screwdriver?ref=discovery_category_newest,101291.0,15,45,45
27,this 3d photo album gets photos out of your phone and onto a piece of handmade art  simply upload your photos and we do the rest,Glass,the United States,Jenny Gaynor,3000,"Los Angeles, CA",Memory Vase - your photos on a custom handmade glass vase,3004.0,memory vase your photos on a custom handmade glass,True,False,successful,https://www.kickstarter.com/projects/1646605847/memory-vase-your-photos-on-a-custom-handmade-glass?ref=discovery_category_newest,3004.0,402,30,30
16,what if the world was going to end in seven days  a comedy about playing video games and a drama about accomplishing your dreams,Anthologies,the United States,Shawn Padraic Murphy,500,"Columbia, MD",The End #3 - Fantasy (Remastered Edition),551.0,the end 3 fantasy remastered edition,True,False,successful,https://www.kickstarter.com/projects/1945380719/the-end-3-fantasy-remastered-edition?ref=discovery_category_newest,551.0,2,30,30
