backers_count,blurb,category,country_displayable_name,creator,goal,location,name,pledged,slug,spotlight,staff_pick,state,urls,usd_pledged,preview_time,fundraising_time,state_change
6,making custom silver  metal jewelry carved and shaped by hand hammer  anvil then sanded  polished into a one of a kind piece,Jewelry,the United States,Michael Witts,2250,"Anaheim, CA",Jewelry & Silversmithing,363.0,jewelry and silversmithing,False,False,failed,https://www.kickstarter.com/projects/430101731/jewelry-and-silversmithing?ref=discovery_category_newest,363.0,11,30,30
4,winston marshall created the kickup ball you can use it for exercising soccer training or soccer ball rebound kicking,Interactive Design,the United States,Winston Marshall,59000,"Spring, TX",KICKUP BALL,53.0,kickup ball,False,False,failed,https://www.kickstarter.com/projects/1092426262/kickup-ball?ref=discovery_category_newest,53.0,21,40,40
29,enamel penguin pins of night  day designs the initial goal funds 2 different pin styles  4 total color options glitter available,Graphic Design,the United States,Amber M Coultis,750,"Kansas City, MO",Night & Day Penguin Pins,973.0,night and day penguin pins,True,False,successful,https://www.kickstarter.com/projects/1941251271/night-and-day-penguin-pins?ref=discovery_category_newest,973.0,43,29,29
84,a festive heartwarming tale for everyone to enjoy,Animation,the United States,Matt Kabus,8000,"Venice, CA","""December Moon"" Animated Music Video",16875.99,december moon animated music video,True,False,successful,https://www.kickstarter.com/projects/890113367/december-moon-animated-music-video?ref=discovery_category_newest,16875.99,13,30,30
142,kids shoes based on kids books,Childrenswear,the United States,Ben Zhu,10000,"Los Angeles, CA",ARTWALKS,11441.0,artwalks,True,False,successful,https://www.kickstarter.com/projects/artwalks/artwalks?ref=discovery_category_newest,11441.0,55,35,35
74,everydaycarry edc cigar keychain rest stand,Product Design,the United States,Goodtimes,800,"Los Angeles, CA","""Rose N Gold"" Solid Brass EDC Cigar Keychain Rest Stand",5972.0,rose n gold solid brass edc keychain from goodtimes,False,False,live,https://www.kickstarter.com/projects/good-times/rose-n-gold-solid-brass-edc-keychain-from-goodtimes?ref=discovery_category_newest,5972.0,19,44,0
14,limited edition rvlvr qseries watch,Jewelry,the United States,RVLVR,500,"Honolulu, HI",Revolver Inspired Swiss Movement Wrist Watch,1982.0,revolver inspired swiss movement wrist watch,True,False,successful,https://www.kickstarter.com/projects/rvlvr/revolver-inspired-swiss-movement-wrist-watch?ref=discovery_category_newest,1982.0,42,14,14
4,full send a coronavirus vacation is a cinematic tour of some of the most iconic ski resorts on the planet all located in the usa,Action,the United States,Zackary Seger,5000,"Denver, CO",Full Send: A Coronavirus Vacation,86.0,full send a coronavirus vacation,False,False,failed,https://www.kickstarter.com/projects/zakseger/full-send-a-coronavirus-vacation?ref=discovery_category_newest,86.0,15,24,24
137,a series of patches and enamel pins focusing on baba yaga the forest and finding a place for yourself to exist as you are,Accessories,the United States,Michi,2100,"Brooklyn, NY",the forest is home - enamel pin and patches series -,4787.0,the forest is home enamel pin and patches series,True,False,successful,https://www.kickstarter.com/projects/1807763531/the-forest-is-home-enamel-pin-and-patches-series?ref=discovery_category_newest,4787.0,183,30,30
14,enamel pin series of our favourite dlc heroes and stretch goals including some dlc wannabes a continuation of my wave 1 roster set,Accessories,the United States,Jeremy Caldwell,250,"Dallas, TX",Smash DLC Heroes and Wannabes: Enamel Pin Series,367.0,by popular demand dlc heroes enamel pin series,True,False,successful,https://www.kickstarter.com/projects/theultimatejeremy/by-popular-demand-dlc-heroes-enamel-pin-series?ref=discovery_category_newest,367.0,1,15,15
20,perfect justice will be an action/comedy starring two 80sstyle cop heroes against an evil ceo with a plot to take over the world,Action,the United States,Chris Piscopo,500,"Peterborough, NH",Perfect Justice (Action/Comedy Film),981.0,perfect justice action comedy film,True,False,successful,https://www.kickstarter.com/projects/1312031135/perfect-justice-action-comedy-film?ref=discovery_category_newest,981.0,163,30,30
33,a anime 3dcg project using an open source softwares blender x freestyle,Animation,the United States,Jerry Miller,13500,"Everett, WA",Akari no Chikai,1181.0,akari no chikai part 1,False,False,failed,https://www.kickstarter.com/projects/1464209280/akari-no-chikai-part-1?ref=discovery_category_newest,1181.0,14,30,30
7,action packed thriller with an exhong kong hitman as he lays low but a new love inadvertently lands him in the hands of the syndicate,Action,the United States,Stephen Saprid and Jeremy Higgs,8650,"Chicago, IL",The Hayabusa Heist (Canceled),100.0,the hayabusa heist,False,False,canceled,https://www.kickstarter.com/projects/luerlockstudios/the-hayabusa-heist?ref=discovery_category_newest,100.0,31,60,43
45,the worlds best selvedge denim affordable preeminent jeans handcrafted in denim mecca kojima japan,Apparel,the United States,KOJIMA GENES x SF PROJECT,5000,"San Francisco, CA",“Made in Japan” Premium Jeans Directly to You - Kojima Genes,8479.0,made in japan premium denim directly to you,True,False,successful,https://www.kickstarter.com/projects/1871595373/made-in-japan-premium-denim-directly-to-you?ref=discovery_category_newest,8479.0,22,50,50
524,no slipping but shaping compression and extreme comfort exceptional leggings designed to let you focus exclusively on your practice,Apparel,the United States,Niyama,22000,"Los Angeles, CA",Niyama: The Next Generation of Yoga Pants,34203.0,niyama the next generation of yoga pants,True,False,successful,https://www.kickstarter.com/projects/niyama/niyama-the-next-generation-of-yoga-pants?ref=discovery_category_newest,34203.0,9,30,30
4,john theodore beverage company is looking to step up from inhome brewing to commercial production capabilities,Drinks,the United States,Joel Martin,25000,"Quincy, WA",John Theodore Beverage Company: Production Upgrade,116.0,john theodore beverage company production upgrade,False,False,failed,https://www.kickstarter.com/projects/jtbeverageco/john-theodore-beverage-company-production-upgrade?ref=discovery_category_newest,116.0,2,30,30
0,kakery box is an ecommerce bakery each month our customers choose a box with a unique flavor story oven to table within 3 days,Small Batch,the United States,Kristal,10000,"Oakland, CA",Kakery Box: Let the Bakery Come to You!,0.0,kakery box let the bakery come to you,False,False,failed,https://www.kickstarter.com/projects/chiefkake/kakery-box-let-the-bakery-come-to-you?ref=discovery_category_newest,0.0,0,23,23
183,we are a group of artisanal food and beverage producers who are working to create a shared manufacturing facility,Small Batch,the United States,Kara Deyhle,22700,"Albuquerque, NM",More Kitchen Space + Collaboration + Plants = Help us grow!,23626.0,more kitchen space collaboration plants help us grow,True,False,successful,https://www.kickstarter.com/projects/newmexicoferments/more-kitchen-space-collaboration-plants-help-us-grow?ref=discovery_category_newest,23626.0,9,43,43
29,a one of a kind experience in the heart of jackson ms,Events,the United States,Midtown Depot,10000,"Jackson, MS",Midtown Depot Art Park & Beer Garden,3521.0,midtown depot art park and beer garden 0,False,False,live,https://www.kickstarter.com/projects/midtowndepot/midtown-depot-art-park-and-beer-garden-0?ref=discovery_category_newest,3521.0,7,59,0
0,i am a registered dietitian who will design healthy and tailored family menu plans that save time  money,Cookbooks,the United States,Kayley George,300,"Houston, TX",À La Carte Nutrition,0.0,a la carte nutrition,False,False,failed,https://www.kickstarter.com/projects/402507384/a-la-carte-nutrition?ref=discovery_category_newest,0.0,3,32,32
147,expansion of awardwinning boutique hot sauce company with two new sauces,Small Batch,the United States,"Ron, Tim, and Sebastian",4000,"Frederick, MD",Black Eyed Susan Spice Company Expansion!,7517.0,black eyed susan spice company expansion,True,False,successful,https://www.kickstarter.com/projects/blackeyedspices/black-eyed-susan-spice-company-expansion?ref=discovery_category_newest,7517.0,189,31,31
16,perform better think faster live healthier using the worlds best butter  flavored  infused with the most natural of ingredients,Farms,the United States,Brandon Foote,10000,"Seattle, WA",The World's Best Butter (Canceled),489.0,the worlds best butter,False,False,canceled,https://www.kickstarter.com/projects/1065300958/the-worlds-best-butter?ref=discovery_category_newest,489.0,6,30,3
10,tired of sauces that dont punch you in the mouth with flavor and tingle your tongue with spices then hurry and back our campain now,Small Batch,the United States,Opi and Reene,5000,"Fresno, CA",Queen Reenee's Gourmet Sauces,656.0,queen reenees gourmet sauces,False,False,failed,https://www.kickstarter.com/projects/1632320185/queen-reenees-gourmet-sauces?ref=discovery_category_newest,656.0,0,30,30
0,this project is focused on the acquisition of a lot and building to bring it back to life as a bright friendly and upbeat restaurant,Restaurants,the United States,Samantha,50000,"Ponchatoula, LA",Bringing great food to our town!,0.0,bringing great food to our town,False,False,failed,https://www.kickstarter.com/projects/315936352/bringing-great-food-to-our-town?ref=discovery_category_newest,0.0,0,60,60
1397,complete compact  costeffective virtual reality walking solution designed entirely for gamers unleash your body in virtual worlds,Gaming Hardware,the United States,KATVR,100000,"San Francisco, CA","KAT Walk C: ""Ready Player One"" VR Treadmill at Your Home!",1667295.0,kat walk c ready player one vr treadmill at your home,True,True,successful,https://www.kickstarter.com/projects/katvr/kat-walk-c-ready-player-one-vr-treadmill-at-your-home?ref=discovery_category_newest,1667295.0,24,40,40
5,brooklyn trattoria invites all of bethany village and surrounding area to take part in creating/funding a special community experience,Restaurants,the United States,Paul LaLone,5500,"Portland, OR",Build Community by Eating Together,81.0,build community by eating together,False,False,failed,https://www.kickstarter.com/projects/705638157/build-community-by-eating-together?ref=discovery_category_newest,81.0,96,15,15
6,chocolates and candies that evoke whimsical sensation through old fashioned candy memories and boozy fun,Small Batch,the United States,jill keller,10000,"Washington, DC",Sense of Whimsy,3176.0,a sense of whimsy,False,False,failed,https://www.kickstarter.com/projects/1343410156/a-sense-of-whimsy?ref=discovery_category_newest,3176.0,14,30,30
2,simple easy to follow restaurant quality recipes for men to use in order to amaze that special someone,Cookbooks,the United States,PJ,9000,"Rockaway, NJ",Cookbook for Men (Recipes That Will Amaze Her),11.0,cookbook for men recipes that will amaze her,False,False,failed,https://www.kickstarter.com/projects/311097279/cookbook-for-men-recipes-that-will-amaze-her?ref=discovery_category_newest,11.0,0,29,29
108,west salem public house is a modern american take on the pub our mugs cultivate a sense of belonging for patrons,Drinks,the United States,West Salem Public House,1000,"Winston-Salem, NC",West Salem Public House,6930.0,west salem public house,True,False,successful,https://www.kickstarter.com/projects/wspublichouse/west-salem-public-house?ref=discovery_category_newest,6930.0,3,31,31
20,join us in creating a fun and exciting place that brings your love of pop culture to life also theres food everybody loves food,Restaurants,the United States,Clinton Jones,35000,"Fullerton, CA",Pop-Ups can be Permanent!,2729.68,pop ups can be permanent,False,False,failed,https://www.kickstarter.com/projects/babygotmacfoodparty/pop-ups-can-be-permanent?ref=discovery_category_newest,2729.68,77,32,32
0,i make custom handcrafted ice cream sandwiches with locally sourced ingredients a chef driven company with a nostalgic feel,Farmer's Markets,the United States,Antonia Grandberry,4000,"Miami, FL",A Kooky Kinda Cookie.,0.0,a kooky kinda cookie,False,False,failed,https://www.kickstarter.com/projects/1875158388/a-kooky-kinda-cookie?ref=discovery_category_newest,0.0,23,30,30
155,future home of flora vegan treats bakery we will have fresh vegan/vegetarian food vegan treats and tasty beverages,Restaurants,the United States,Isabelle Forbes,10000,"Louisville, KY",Flora Kitchenette - A Vegan Breakfast Menu for Louisville!,10115.0,flora kitchenette a vegan breakfast menu for louis,True,False,successful,https://www.kickstarter.com/projects/isaforbes/flora-kitchenette-a-vegan-breakfast-menu-for-louis?ref=discovery_category_newest,10115.0,42,26,26
176,raising funds to install a custom draft system and taproom bar at our small new york state focused farmbrewery in gowanus brooklyn,Drinks,the United States,Jason Sahler,20000,"Brooklyn, NY",Strong Rope Brewery: Building a Draft System and Taproom Bar,20795.0,strong rope brewery building a draft system and ta,True,True,successful,https://www.kickstarter.com/projects/1005854974/strong-rope-brewery-building-a-draft-system-and-ta?ref=discovery_category_newest,20795.0,14,22,22
7,wodfee is developed specifically for individuals who ask for more out of their mind body and life  try a bag with our kickstarter,Drinks,the United States,WodFee,5000,"Columbus, OH",WodFee Coffee Company,97.0,wodfee coffee company,False,False,failed,https://www.kickstarter.com/projects/581126356/wodfee-coffee-company?ref=discovery_category_newest,97.0,3,30,30
43,lauching our handmade hickory bbq sauces nationally,Small Batch,the United States,Hickory BBQ,1500,"Fort Myers, FL",Hickory's World Famous BBQ Sauce,1764.0,hickorys world famous bbq sauce,True,False,successful,https://www.kickstarter.com/projects/hickorybbq/hickorys-world-famous-bbq-sauce?ref=discovery_category_newest,1764.0,3,30,30
5,i want to create an app and loyalty card system for restaurants to use for needy people so that the left over food doesnt go to waste,Restaurants,the United States,Rachel,15000,"Hedgesville, WV",No more Hunger,78.0,no more hunger,False,False,failed,https://www.kickstarter.com/projects/965219475/no-more-hunger?ref=discovery_category_newest,78.0,0,59,59
4,help us open a store front we currently sell out of our home at farmers markets festivals fairs and private parties,Farmer's Markets,the United States,Kevin,380000,"Pearland, TX",The Sweet Fox Fudge Open's It's Doors,630.0,the sweet fox fudge opens its doors,False,False,failed,https://www.kickstarter.com/projects/2126015546/the-sweet-fox-fudge-opens-its-doors?ref=discovery_category_newest,630.0,38,30,30
58,small batch artisanal mustards with flavors that span the globe help us create our product and get this seed of an idea off the ground,Small Batch,the United States,Valerie Koonce,3000,"Boise, ID",The Curvy Spoon - flavorful handmade artisanal mustard,3435.0,the curvy spoon flavorful handmade mustard,True,False,successful,https://www.kickstarter.com/projects/995149784/the-curvy-spoon-flavorful-handmade-mustard?ref=discovery_category_newest,3435.0,16,30,30
1,we are creating a 6 acre micro farm in the okc area  we will raise chickens goats garlic/lavender to sell at local markets,Farms,the United States,Brian Pence,30000,"Newalla, OK",Fund the Family Farm,1.0,fund the family farm,False,False,failed,https://www.kickstarter.com/projects/930325429/fund-the-family-farm?ref=discovery_category_newest,1.0,1,30,30
0,"basically were making chicken n waffles

we will give away free wings and waffles each month to anyone who wants it",Food Trucks,the United States,TAM W,200,"Dallas, TX",CHICKEN AND WAFFLES,0.0,chicken and waffles,False,False,failed,https://www.kickstarter.com/projects/falkingfoods/chicken-and-waffles?ref=discovery_category_newest,0.0,2,30,30
8,im creating a popup edible plant shop for brooklyn,Farms,the United States,Gavin Curran,5000,"Greenpoint, NY",Brooklyn Pop-up Edible Plant Shop,400.0,popup edible and useful plant nursery,False,False,failed,https://www.kickstarter.com/projects/516385582/popup-edible-and-useful-plant-nursery?ref=discovery_category_newest,400.0,2,30,30
1,help me in my quest to develop  using my years of experience and rigorous trial and error  the worlds best chocolate chip cookie,Small Batch,the United States,JD Stewart,500,"San Jose, CA",Develop the World's Most Perfect Chocolate Chip Cookie!,1.0,develop the worlds most perfect chocolate chip coo,False,False,failed,https://www.kickstarter.com/projects/366772935/develop-the-worlds-most-perfect-chocolate-chip-coo?ref=discovery_category_newest,1.0,6,30,30
32,2 dogs hot sauce is just really good sauce if you like heat and you want the flavor to match it you have come to the right place,Small Batch,the United States,Brian Jones,3000,"Detroit, MI",2 Dogs Hot Sauce Michigan Crowdfunding,3375.0,2 dogs hot sauce michigan crowdfunding,True,False,successful,https://www.kickstarter.com/projects/1585019411/2-dogs-hot-sauce-michigan-crowdfunding?ref=discovery_category_newest,3375.0,2,31,31
3,i want to take my unemployed boyfriend out to dinner  hes working on a startup but doesnt have any income right now,Events,the United States,Crystal Rose Bale,50,"Phoenix, AZ",Dinner for Two,31.0,dinner for two,False,False,failed,https://www.kickstarter.com/projects/1452901460/dinner-for-two?ref=discovery_category_newest,31.0,3,30,30
0,this food truck will be operated by gregory bic thomas an inspiring chef now wanting to go mobile great food awesome personalities,Food Trucks,the United States,Bic's LunchBox,30000,"Orlando, FL",Bic's LunchBox,0.0,bics lunchbox,False,False,failed,https://www.kickstarter.com/projects/758297570/bics-lunchbox?ref=discovery_category_newest,0.0,2,59,59
228,collect resources conquer enemy territory and build virtual towers on real buildings to ensure victory for your race,Mobile Games,the United States,Breadboard,30000,"Orlando, FL",Terra Mango: A Location-Based Strategy Game,6391.0,terra mango a location based strategy game,False,False,failed,https://www.kickstarter.com/projects/breadboard/terra-mango-a-location-based-strategy-game?ref=discovery_category_newest,6391.0,100,30,30
0,we want to bring street food to unc and to greeley,Food Trucks,the United States,Blake Jackson,5000,"Greeley, CO",Feed the Bears!!!,0.0,feed the bears,False,False,failed,https://www.kickstarter.com/projects/472473143/feed-the-bears?ref=discovery_category_newest,0.0,16,45,45
15,double gold winning california  gluten free vodka going to the next level,Drinks,the United States,Nate Erdman,50000,"San Jose, CA",Diamond Glacier 33 Vodka,1551.0,diamond glacier 33 vodka,False,False,failed,https://www.kickstarter.com/projects/33belowspirits/diamond-glacier-33-vodka?ref=discovery_category_newest,1551.0,61,45,45
108,we need help to complete our downtown distillery and continue our tradition of grain to glass whiskey distillation,Drinks,the United States,Michael & Lorraine Barber,20000,"Petaluma, CA",Complete the Barber Lee Spirits Distillery!,22288.5,help complete the barber lee spirits distillery,True,False,successful,https://www.kickstarter.com/projects/1923331064/help-complete-the-barber-lee-spirits-distillery?ref=discovery_category_newest,22288.5,6,32,32
31,im opening an incredibly fun burger restaurant in la its gonna be wacky its gonna be tasty click on campaign  to read more,Restaurants,the United States,Richard DiLorenzo,15000,"Los Angeles, CA",Ronny Jockets - A Burger Joint,3121.01,ronny jockets a burger joint,False,True,failed,https://www.kickstarter.com/projects/112861821/ronny-jockets-a-burger-joint?ref=discovery_category_newest,3121.01,4,21,21
29,want to take oneil and sons brew home  help us change our brewers permit to a brewpub license and support your local brewery,Drinks,the United States,Michael ONeil,5000,"Port Lavaca, TX",O'Neil and Sons Brewing Company - Take Your Craft Beer to Go,5130.0,oneil and sons brewing company,True,False,successful,https://www.kickstarter.com/projects/784628764/oneil-and-sons-brewing-company?ref=discovery_category_newest,5130.0,0,60,60
1,airwarz is a hitech real life uav lasertag gaming concept which puts you in the middle of the action,Live Games,the United States,Joel Krouse,75000,"Houston, TX",AirWarZ,5.0,airwarz,False,False,failed,https://www.kickstarter.com/projects/1375856151/airwarz?ref=discovery_category_newest,5.0,4,30,30
20,raising money to fund nationwide bus tour  educate americans to end to federal prohibition on hemp,Farms,the United States,Rick Trojan,15000,"Denver, CO",Hemp Road Trip - Spring 2016,1236.0,hemp road trip spring 2016,False,False,failed,https://www.kickstarter.com/projects/441165504/hemp-road-trip-spring-2016?ref=discovery_category_newest,1236.0,8,36,36
744,its the pharisees vs the disciples in this new take on a classic party game its like mafia but with a lot more bible verses,Live Games,the United States,Kenny & Elle Campbell,4000,"Atlanta, GA",PHARISEES: The Party Game,21307.0,pharisees the party game,True,False,successful,https://www.kickstarter.com/projects/kennycampbell/pharisees-the-party-game?ref=discovery_category_newest,21307.0,11,33,33
2,i have started a nonprofit hydroponic lettuce farm that will also produce other vegetables and fruit and herbs plus livestock as well,Farms,the United States,Minister William J. Winkelman,277800,"Erie, PA",Celestial Farms,11.0,celestial farms,False,False,failed,https://www.kickstarter.com/projects/722458815/celestial-farms?ref=discovery_category_newest,11.0,0,60,60
2,a place name sliders town where you can buy different type of sliders pork belly beef chicken and meatball,Restaurants,the United States,Miguel Raphael,6000,"San Diego, CA",SLIDERS TOWN,16.0,sliders town,False,False,failed,https://www.kickstarter.com/projects/2071856397/sliders-town?ref=discovery_category_newest,16.0,1,60,60
86,given the chance we are looking forward to providing the community an authentic experience rooted in our family traditions  values,Food,the United States,Kristiana & J,20000,"Denver, CO",Cannoli & Coffee,20579.2,cannoli and coffee,True,False,successful,https://www.kickstarter.com/projects/cannoliandcoffee/cannoli-and-coffee?ref=discovery_category_newest,20579.2,101,30,30
15,sets of handcrafted wooden cube dice with 24 burned runes,Games,the United States,Oikos Dizajn,200,"Walla Walla, WA",Wood Runes Dice Sets: Elder Futhark Divination Nordic Viking,329.0,wood runes dice sets elder futhark divination nordic viking,False,False,live,https://www.kickstarter.com/projects/oikosdizajn/wood-runes-dice-sets-elder-futhark-divination-nordic-viking?ref=discovery_category_newest,329.0,5,26,0
4,an all natural low calorie spiked lemonade with multiple flavors,Drinks,the United States,Freshly Lemonade,10000,"New Haven, CT",Spiked Lemonade - Low calorie and all natural,69.0,spiked lemonade low calorie and all natural,False,False,failed,https://www.kickstarter.com/projects/freshly/spiked-lemonade-low-calorie-and-all-natural?ref=discovery_category_newest,69.0,63,60,60
1,public youtube channel dedicated to game and  electronic reviews news and videos from a gamer and electronic lover,Gaming Hardware,the United States,Luis Perez,1000,"Santa Ana, CA","Game and Electronic Reviews, News, and Videos",63.0,game and electronic reviews news and videos,False,False,failed,https://www.kickstarter.com/projects/1302345402/game-and-electronic-reviews-news-and-videos?ref=discovery_category_newest,63.0,2,29,29
40,a specialty coffee and liege waffle coffee house who employs and mentors teens aging out of foster care,Restaurants,the United States,Jessica Leal and Rachel Smith,35000,"Yukon, OK",The Red Bird Coffee House,4144.0,the red bird coffee house,False,False,failed,https://www.kickstarter.com/projects/1991403938/the-red-bird-coffee-house?ref=discovery_category_newest,4144.0,2,60,60
11,a small portable modifiable and stylish arcade cabinet with support for over 35 consoles and other classic arcade systems,Gaming Hardware,the United States,Microcade Systems,8000,"Park City, UT",The Microcade: A Pre-Built Retro Arcade Cabinet,1152.0,the microcade a pre built retro arcade cabinet,False,False,failed,https://www.kickstarter.com/projects/microcadesystems/the-microcade-a-pre-built-retro-arcade-cabinet?ref=discovery_category_newest,1152.0,335,36,36
1,so i can have a job all my friends say that i am a very good cook and that i should open a restaurant ill start with a food truck,Food Trucks,the United States,Wyatt Bernard Bradley,30000,"Lafayette, LA",Food Truck to cook anywhere such the many festivals in La.,10.0,food truck to cook anywhere such the many festival,False,False,failed,https://www.kickstarter.com/projects/1607024106/food-truck-to-cook-anywhere-such-the-many-festival?ref=discovery_category_newest,10.0,0,30,30
6,were opening a pie shop to bring our southern baking traditions and the joy of eating homemade pie to pie lovers across los angeles,Restaurants,the United States,Brianna,50000,"Los Angeles, CA",Los Angeles Pie Shop for Pie Lovers!,452.0,los angeles pie shop for pie lovers,False,False,failed,https://www.kickstarter.com/projects/2102740226/los-angeles-pie-shop-for-pie-lovers?ref=discovery_category_newest,452.0,20,30,30
9,we are speciality small batch coffee roaster bringing ethically sourced beans from around the world into your favorite cup of joe,Small Batch,the United States,Brandon Simmons,8000,"Pittsburgh, PA",Fuzzy Monkey Coffee Co.,212.0,fuzzy monkey coffee co,False,False,failed,https://www.kickstarter.com/projects/fuzzymonkeycoffee/fuzzy-monkey-coffee-co?ref=discovery_category_newest,212.0,7,35,35
