backers_count,blurb,category,country_displayable_name,creator,goal,location,name,pledged,slug,spotlight,staff_pick,state,urls,usd_pledged,preview_time,fundraising_time,state_change
172,help fund the first recording of a beautiful sacred oratorio by a major baroque composer your donation is taxdeductible,Classical Music,the United States,ACRONYM,15000,"New York, NY",ACRONYM & TENET present Schmelzer: Le Memorie Dolorose,16424.0,acronym and tenet present schmelzer le memorie dol,True,False,successful,https://www.kickstarter.com/projects/acronym/acronym-and-tenet-present-schmelzer-le-memorie-dol?ref=discovery_category_newest,16424.0,1164,30,30
2390,perfectly pixeled isometric srpg featuring dynamic job classes character driven plot strategic grid battles  an eclectic jazz ost,Video Games,the United States,Becca Bair,90000,"Austin, TX",Arcadian Atlas - Tactical RPG Inspired by Classics,95204.55,arcadian atlas tactical rpg inspired by classics,True,False,successful,https://www.kickstarter.com/projects/1266693296/arcadian-atlas-tactical-rpg-inspired-by-classics?ref=discovery_category_newest,95204.55,132,33,33
739,a core rulebook and setting guide for the fantasy world of mnemonic,Tabletop Games,the United States,Dee Pennyway,21000,"Lexington, SC",Mnemonic: A Weaver’s Almanac,26090.0,mnemonic a weavers almanac,True,False,successful,https://www.kickstarter.com/projects/mnemonicrpg/mnemonic-a-weavers-almanac?ref=discovery_category_newest,26090.0,58,31,31
12,debut album by louisville based songwriter  eclectic mix of folkrock bluegrass and influenced by all manner of musical oddities,Country & Folk,the United States,Ben Jones,2500,"Louisville, KY",Songs You Could Play...were you so inclined,2500.0,songs you could playwere you so inclined,True,False,successful,https://www.kickstarter.com/projects/1747364321/songs-you-could-playwere-you-so-inclined?ref=discovery_category_newest,2500.0,9,42,42
117,we have completed recording mixing and mastering a 14 song album  we need more funds for cd duplication radio promo and publicity,Country & Folk,the United States,The Appalucians,10000,"Black Mountain, NC",The Appalucians' Debut Album Bright Hills,10209.0,the appalucians debut album bright hills,True,False,successful,https://www.kickstarter.com/projects/1046971224/the-appalucians-debut-album-bright-hills?ref=discovery_category_newest,10209.0,127,21,21
269,conversations at the leading edge of human intelligence  maturity  facing the darkness and alive to the hope on the other side of it,Audio,the United States,A New Republic of the Heart Podcast,10000,"San Francisco, CA",Dispatches from A New Republic of the Heart Podcast,21332.0,dispatches from a new republic of the heart podcast,True,False,successful,https://www.kickstarter.com/projects/new-republic-heart/dispatches-from-a-new-republic-of-the-heart-podcast?ref=discovery_category_newest,21332.0,19,32,32
2,im looking for money to fund my new edm projects album and achieve the musical goal ive always dreamed of reaching,Electronic Music,the United States,Alex Jongbloed,1000,"Los Angeles, CA",Following The Music,101.0,following the music,False,False,failed,https://www.kickstarter.com/projects/1878799349/following-the-music?ref=discovery_category_newest,101.0,0,60,60
0,i am going to travel to kurdishcontrolled northern iraq to document the suffering of the kurdish people for air travel and expenses,Photo,the United States,Michael Lynn,8500,"Erbil, Iraq",Photographing the plight of the Kurdish people,0.0,photographing the plight of the kurdish people,False,False,failed,https://www.kickstarter.com/projects/1621124387/photographing-the-plight-of-the-kurdish-people?ref=discovery_category_newest,0.0,0,40,40
0,my program is help combat depression and reduce the chance of suicide among teens,Web,the United States,Raven,6000,"Los Angeles, CA",Writing Rescues Imaginative Thinkers Everyday (WRITE),0.0,writing rescues imaginative thinkers everyday writ,False,False,failed,https://www.kickstarter.com/projects/138012552/writing-rescues-imaginative-thinkers-everyday-writ?ref=discovery_category_newest,0.0,42,30,30
9,i am a vietnam vet with a dream to play and sing the music from my heart this cd will allow me to share my music with everyone,Blues,the United States,Rick Yancey    ( SNAPSHOT ),950,"San Antonio, TX","Recording, mixing, mastering & PR materials for my debut CD",950.0,recording mixing mastering and pr materials for my,True,False,successful,https://www.kickstarter.com/projects/1945500439/recording-mixing-mastering-and-pr-materials-for-my?ref=discovery_category_newest,950.0,318,30,30
237,the wizard school rpg,Tabletop Games,the United States,Tanner Wilson,4500,"Northampton, MA",Magic School Mystery,6391.0,magic school mystery,True,False,successful,https://www.kickstarter.com/projects/magicschoolmystery/magic-school-mystery?ref=discovery_category_newest,6391.0,98,15,15
96,hear now  a festival of new music by contemporary la composers is applauded in our video by esapekka salonen please check it out,Classical Music,the United States,Hugh Levick,9000,"Venice, CA",HEAR NOW--An Annual Festival of New Music by  LA Composers,9446.0,hear now an annual festival of new music by la com,True,False,successful,https://www.kickstarter.com/projects/hearnow2021/hear-now-an-annual-festival-of-new-music-by-la-com?ref=discovery_category_newest,9446.0,3,59,59
148,help make learning about science more exciting and relevant to students by making snk easier to use in the classroom,Journalism,the United States,"Science News, a publication of SSP",5000,"Washington, DC",Science Stories for the Classroom,8761.01,science stories for the classroom,True,False,successful,https://www.kickstarter.com/projects/1241141456/science-stories-for-the-classroom?ref=discovery_category_newest,8761.01,55,15,15
0,as  the  title suggests this is a dance/electro album much like many more before it,Electronic Music,the United States,Phillip Mayberry,250,"Asheville, NC",Yet Another Dance Electro Album,0.0,yet another dance electro album,False,False,failed,https://www.kickstarter.com/projects/1938596825/yet-another-dance-electro-album?ref=discovery_category_newest,0.0,3,15,15
10,recording and mastering electro rock music for your listening and dancing pleasure,Electronic Music,the United States,crinkle Kut carrot,2500,"Bedford, MA",crinkle Kut carrot,333.0,crinkle kut carrot,False,False,failed,https://www.kickstarter.com/projects/crinklekutcarrot/crinkle-kut-carrot?ref=discovery_category_newest,333.0,3,30,30
0,the lore online is a game changer its where all audiences learn the latest news or write their own lets make reading fun again,Web,the United States,Anthony Russo,2000,"Bricktown, NJ",The Lore Online,0.0,the lore online,False,False,failed,https://www.kickstarter.com/projects/1291412770/the-lore-online?ref=discovery_category_newest,0.0,1,60,60
2,we are focused on helping artists create a sustainable and successful career in the arts,Classical Music,the United States,Tien Mai,50000,"New York, NY",Opera Singers Initiative,155.0,opera singers initiative,False,False,failed,https://www.kickstarter.com/projects/663641293/opera-singers-initiative?ref=discovery_category_newest,155.0,12,59,59
54,the worlds first intercollegiate science publication led by the top universities in the world and we need your help to get started,Journalism,the United States,Stephen Cognetta,3500,"Princeton, NJ",International Collegiate Science Journal,6220.0,international collegiate science journal,True,True,successful,https://www.kickstarter.com/projects/108938845/international-collegiate-science-journal?ref=discovery_category_newest,6220.0,38,30,30
1,a collection of random motions from the streets of new orleans,Photo,the United States,Kathleene Quinn,1245,"London, UK",Strangers: Making A Living and Art (Canceled),1.0,strangers making a living and art,False,False,canceled,https://www.kickstarter.com/projects/kathleenequinn/strangers-making-a-living-and-art?ref=discovery_category_newest,1.0,0,31,9
4,this will be nutrons debut ep  after 4 years of playing the club scene and working on getting to know programs the time is here,Electronic Music,the United States,Jimmy Whittemore,7500,"New York, NY",Nutron's First Studio EP,295.0,nutrons big expansion,False,False,failed,https://www.kickstarter.com/projects/1472045298/nutrons-big-expansion?ref=discovery_category_newest,295.0,274,30,30
260,a podcast and video series called black diplomats featuring interviews with poc and women who specialize in global affairs,Audio,the United States,Terrell Jermaine Starr,16000,"New York, NY",Black Diplomats - Decolonize the global affairs conversation,17118.0,black diplomats decolonize the global affairs conversation,True,True,successful,https://www.kickstarter.com/projects/blackdiplomats/black-diplomats-decolonize-the-global-affairs-conversation?ref=discovery_category_newest,17118.0,244,31,31
2,this is what i am artificialis is me its my soul technolyze is merely the beginning of a series where i am technolyzed,Electronic Music,the United States,John David Kelly,15000,"Jacksonville, FL",Artificialis - Technolyze (Debut Album!),106.0,artificialis technolyze debut album,False,False,failed,https://www.kickstarter.com/projects/johndkelly/artificialis-technolyze-debut-album?ref=discovery_category_newest,106.0,0,30,30
57,a new album by crispin schroeder,Music,the United States,Crispin Schroeder,6500,"New Orleans, LA",Dreaming and Waking,6716.0,dreaming and waking,True,False,successful,https://www.kickstarter.com/projects/1450429001/dreaming-and-waking?ref=discovery_category_newest,6716.0,15,30,30
2,we are doing a news and infotainment news service website eventsofourtimescom we also sell products on our website like commodities,Audio,the United States,Nathan Jimenez,100000,"Portland, OR",Help us Launch our News Service Website Eventsofourtimes.com,34.0,help us launch our news service website eventsofou,False,False,failed,https://www.kickstarter.com/projects/1177730344/help-us-launch-our-news-service-website-eventsofou?ref=discovery_category_newest,34.0,2,60,60
43,a new houstonbased party band for all generations,Music,the United States,Meagan Isaacks,3500,"Friendswood, TX",“The Instructors”,3500.0,the instructors,True,False,successful,https://www.kickstarter.com/projects/theinstructors/the-instructors?ref=discovery_category_newest,3500.0,10,35,35
103,"a postapocalyptic science fantasy rpg zine for zine quest 3 
written for 5e and easy conversion to other systems",Tabletop Games,the United States,Brian Dalrymple,1200,"Davie, FL",The Void of Thrantar - Zine Quest 3,2308.0,the void of thrantar zine quest 3,True,False,successful,https://www.kickstarter.com/projects/113664363/the-void-of-thrantar-zine-quest-3?ref=discovery_category_newest,2308.0,13,14,14
1,a podcast dedicated to all things spooky paranormal and horror related,Audio,the United States,Ragen  (AKA Disruptive Girl),300,"Las Vegas, NV",Ramblings of a Disruptive Girl Podcast,1.0,ramblings of a disruptive girl podcast,False,False,failed,https://www.kickstarter.com/projects/disruptivegirl/ramblings-of-a-disruptive-girl-podcast?ref=discovery_category_newest,1.0,3,30,30
269,this june sybarite5 will record its latest album outliers consisting of 11 new works by 10 young acclaimed american composers,Classical Music,the United States,Sybarite5,20000,"New York, NY",Sybarite5 presents: OUTLIERS,21261.77,sybarite5 presents outliers,True,True,successful,https://www.kickstarter.com/projects/sybarite5/sybarite5-presents-outliers?ref=discovery_category_newest,21261.77,3,24,24
57,preorder copies now of my new release the montague hotel and help support the project and get it into your hands fast,Country & Folk,the United States,Brad Boyer,6000,"Houston, TX",Help Support the Montague Hotel,6339.0,help support the montague hotel,True,False,successful,https://www.kickstarter.com/projects/1510280965/help-support-the-montague-hotel?ref=discovery_category_newest,6339.0,26,30,30
267,were recording an album help us get our unique mashups of classical and pop music out there for everyone to enjoy,Classical Music,the United States,Well-Strung,35000,"Manhattan, NY",Well-Strung is recording a new album - 'POPssical',36490.0,well strung is recording a new album popssical,True,False,successful,https://www.kickstarter.com/projects/164245923/well-strung-is-recording-a-new-album-popssical?ref=discovery_category_newest,36490.0,26,30,30
1138,studies in sorcery is an engine building and drafting game for 14 players about getting your masters degree in the dark arts,Tabletop Games,the United States,Weird Giraffe Games,5900,"Huntsville, AL",Studies in Sorcery,33095.0,degrees in darkness,True,False,successful,https://www.kickstarter.com/projects/weirdgiraffegames/degrees-in-darkness?ref=discovery_category_newest,33095.0,61,23,23
23,a vinyl record for the 10th rb album by joshua jaymz deezy,R&B,the United States,Joshua James Dennis,500,"Goldsboro, NC",10 Play Vinyl Project,841.0,10 play vinyl project,True,False,successful,https://www.kickstarter.com/projects/deezygoeshard/10-play-vinyl-project?ref=discovery_category_newest,841.0,6,21,21
1,site will offer self love self care and inspirational content such as ebooks online courses and coaching,Web,the United States,Rick Lewis,5800,"Shoreview, MN",Membership site for Life Coaching,1.0,membership site for life coaching,False,False,failed,https://www.kickstarter.com/projects/rickdlewis/membership-site-for-life-coaching?ref=discovery_category_newest,1.0,24,30,30
468,ten years of my life are held in these songs with musicians from every continent joining me to tell these stories folk  world music,Country & Folk,the United States,David LaMotte,36300,"Asheville, NC",The Other Way Around,41864.0,the other way around,True,False,successful,https://www.kickstarter.com/projects/davidlamotte/the-other-way-around?ref=discovery_category_newest,41864.0,41,30,30
26,evergreen grass band is making a second album we need your help to make it great,Country & Folk,the United States,Evergreen Grass Band,2300,"Eau Claire, WI",Evergreen Grass Band - Album 2,2389.0,evergreen grass band a new album,True,False,successful,https://www.kickstarter.com/projects/1359018323/evergreen-grass-band-a-new-album?ref=discovery_category_newest,2389.0,0,38,38
5,after his debut album premiered last year ira is ready to take the world by storm with his first studio album homeward,Classical Music,the United States,Ira A. McIntosh,10000,"Seattle, WA",Homeward - The first studio album from Ira A. McIntosh,151.0,homeward the first studio album from ira a mcintos,False,False,failed,https://www.kickstarter.com/projects/2048586718/homeward-the-first-studio-album-from-ira-a-mcintos?ref=discovery_category_newest,151.0,23,30,30
32,the hummingbird suzuki academy is dedicated to music ability development from age zero this suzuki program focuses on ages 03,Classical Music,the United States,Sarah Pizzichemi and Sarah Wenger,3400,"Seattle, WA",Hummingbird Suzuki Academy: Music Classes for Children,3460.0,hummingbird suzuki academy music classes for child,True,False,successful,https://www.kickstarter.com/projects/446930844/hummingbird-suzuki-academy-music-classes-for-child?ref=discovery_category_newest,3460.0,22,13,13
89,dan whitaker  the shinebenders are releasing the vinyl edition of their fourth album far far away,Country & Folk,the United States,Dan Whitaker,5000,"Chicago, IL","Dan Whitaker’s Fourth Album ""Far, Far Away"" on Vinyl",5551.0,dan whitakers fourth album far far away on vinyl,True,False,successful,https://www.kickstarter.com/projects/dan-whitaker-vinyl/dan-whitakers-fourth-album-far-far-away-on-vinyl?ref=discovery_category_newest,5551.0,17,30,30
55,everyones solved mazes while looking from above thats childs play  when youre actually in the maze everything looks different,Puzzles,the United States,Brad Hough,2500,"Brambleton, VA",The Maze: A First-Person Perspective Puzzle Book,2852.0,the maze a resource for storytellers and game mast,True,False,successful,https://www.kickstarter.com/projects/403492553/the-maze-a-resource-for-storytellers-and-game-mast?ref=discovery_category_newest,2852.0,7,55,55
66,a new cd by charlie mosbrook of traditional folk songs that have influenced my songwriting beliefs music through the years,Country & Folk,the United States,Charlie Mosbrook,1200,"Cleveland, OH",Hear Me Callin': A Collection of American Folk Songs,1806.0,hear me callin a collection of american folk songs,True,False,successful,https://www.kickstarter.com/projects/charliemosbrook/hear-me-callin-a-collection-of-american-folk-songs?ref=discovery_category_newest,1806.0,0,31,31
138,an online publication of revolutionary politics based in chicago recognizeksru,Web,the United States,Sean Larson,6000,"Chicago, IL",Masses Magazine,7338.0,masses magazine,True,True,successful,https://www.kickstarter.com/projects/masses/masses-magazine?ref=discovery_category_newest,7338.0,3,29,29
29,help send las tubas de tucson to kalamazoo mi for the 2012 international womens brass conference,Classical Music,the United States,Las Tubas de Tucson,2100,"Tucson, AZ",Send Las Tubas de Tucson to the 2012 IWBC,2582.0,send las tubas de tucson to the 2012 iwbc,True,False,successful,https://www.kickstarter.com/projects/lastubas/send-las-tubas-de-tucson-to-the-2012-iwbc?ref=discovery_category_newest,2582.0,30,42,42
281,the longawaited often asked for endlessly suggested live recording from moors  mccumber 22 songs 12 instruments 2 guys 1 night,Country & Folk,the United States,James Moors & Kort McCumber,22500,"Boulder, CO",A New Moors & McCumber recording - LIVE from Blue Rock,25525.0,a new moors and mccumber recording live from blue,True,False,successful,https://www.kickstarter.com/projects/moorsandmccumber/a-new-moors-and-mccumber-recording-live-from-blue?ref=discovery_category_newest,25525.0,50,31,31
218,in the snowy reaches of door county wi singersongwriter katie dahl is hard at work making her third album heres how you can help,Country & Folk,the United States,Katie Dahl,10000,"Baileys Harbor, WI",Turn Stones to Diamonds: Help Make Katie Dahl's New Record,15955.23,turn stones to diamonds help make katie dahls new,True,False,successful,https://www.kickstarter.com/projects/katiedahlmusic/turn-stones-to-diamonds-help-make-katie-dahls-new?ref=discovery_category_newest,15955.23,13,31,31
114,help the lswo travel to chicago for a concert at the midwest convention in december,Classical Music,the United States,Lone Star Wind Orchestra,15000,"Dallas, TX",Lone Star Wind Orchestra is going to Chicago!,18360.0,lone star wind orchestra is going to chicago,True,False,successful,https://www.kickstarter.com/projects/750516837/lone-star-wind-orchestra-is-going-to-chicago?ref=discovery_category_newest,18360.0,17,30,30
7,many highprofile cases of terminal childhood cancer in the news media this year have been dipg yet it remains unknown and unspoken,Journalism,the United States,Janet Demeter,500,"Santa Clarita, CA","""JUST SAY IT!"" (Getting a National Day for DIPG)",566.0,just say it getting a national day for dipg,True,False,successful,https://www.kickstarter.com/projects/dipg/just-say-it-getting-a-national-day-for-dipg?ref=discovery_category_newest,566.0,13,12,12
32,help fund my nyc recital debut and the launch of my new persona june 28th 2015 500pm,Classical Music,the United States,Erica Mundy ----> Erica Page,1200,"New York, NY",Erica Page's Recital Debut,1949.0,erica pages recital debut,True,False,successful,https://www.kickstarter.com/projects/1311950653/erica-pages-recital-debut?ref=discovery_category_newest,1949.0,6,49,49
1,i am writing about overcoming fear to live my dreams along with photos and cartoons also about health nature adventure  lifestyle,Web,the United States,Galen,1026,"Ventimiglia, Italy",CavemanSpaceman - Adventures in Sustainability,100.0,cavemanspaceman adventures in sustainability,False,False,failed,https://www.kickstarter.com/projects/cavemanspaceman/cavemanspaceman-adventures-in-sustainability?ref=discovery_category_newest,100.0,4,30,30
206,sneaky ninja is a mario meets mark of the ninja 2d stealth platformer for pc/wii u the kind of stealth game nintendo would make,Video Games,the United States,Starfall Studios,10000,"South Plainfield, NJ",Sneaky Ninja - A 2D stealth platformer,10867.0,sneaky ninja,True,False,successful,https://www.kickstarter.com/projects/starfallstudios/sneaky-ninja?ref=discovery_category_newest,10867.0,38,29,29
2,skelly is a recreational game played with popsicle sticks checkers and a skelly board,Tabletop Games,the United States,Robert Spiering,1000,"Wauwatosa, WI",The Skelly Project,601.0,the skelly project 1,False,False,live,https://www.kickstarter.com/projects/theskellyproject/the-skelly-project-1?ref=discovery_category_newest,601.0,0,59,0
83,help get me into the studio and record a full band version of my song right side of history,Country & Folk,the United States,Cheley Tackett,2000,"Nashville, TN",Right Side of History,3905.0,right side of history,True,False,successful,https://www.kickstarter.com/projects/cheleytackett/right-side-of-history?ref=discovery_category_newest,3905.0,0,14,14
41,the acoustic folk/americana project the lost sleep is the music of singersongwriter amanda penecale and friends based in nashville,Country & Folk,the United States,Amanda Penecale and The Lost Sleep,3500,"Nashville, TN",Amanda Penecale and The Lost Sleep make an EP,3610.0,amanda penecale and the lost sleep make an ep,True,False,successful,https://www.kickstarter.com/projects/482861099/amanda-penecale-and-the-lost-sleep-make-an-ep?ref=discovery_category_newest,3610.0,42,34,34
206,we are recording our second fulllength album with mike robinson of railroad earth as our producer,Country & Folk,the United States,Meadow Mountain,21850,"Denver, CO",Meadow Mountain's Sophomore Album,24741.9,meadow mountains sophomore album,True,False,successful,https://www.kickstarter.com/projects/874566714/meadow-mountains-sophomore-album?ref=discovery_category_newest,24741.9,59,27,27
1,vtme magazine is a breath of fresh air a magazine aimed at spreading positivity and untold stories of regular everyday folk,Journalism,the United States,Sandra Bray,165000,"Atlanta, GA",Visualize Through My Eyes (V.T.M.E.),1.0,visualize through my eyes vtme,False,False,failed,https://www.kickstarter.com/projects/pozitivevibes/visualize-through-my-eyes-vtme?ref=discovery_category_newest,1.0,312,60,60
2,lets hear it is a female empowerment platform and publication focused on sharing stories about leading women,Web,the United States,Maya Frai,1200,"New York, NY",Let's Hear It: Female Empowerment Platform,26.0,lets hear it female empowerment platform,False,False,failed,https://www.kickstarter.com/projects/1616008883/lets-hear-it-female-empowerment-platform?ref=discovery_category_newest,26.0,102,45,45
21,the slapinsolomon viola duo will be recording a new album of allviola pieces by scott slapin this summer,Classical Music,the United States,Tanya Solomon,1200,"North Plainfield, NJ","All Viola, All The Time",1275.0,all viola all the time,True,False,successful,https://www.kickstarter.com/projects/violaduo/all-viola-all-the-time?ref=discovery_category_newest,1275.0,11,36,36
4,one mans story all of our solution,Video,the United States,"Carmelo ""MELLZY"" Sanchez",1250,"Fredericksburg, VA",HOMELESS. (Canceled),191.0,homeless,False,False,canceled,https://www.kickstarter.com/projects/strxnger/homeless?ref=discovery_category_newest,191.0,3,35,27
177,through personal  musical growth and the support  love of good friends its come time to make the record ive always wanted to make,Country & Folk,the United States,Matt Haeck,19999,"Nashville, TN",Matt Haeck Debut LP,22340.56,matt haeck debut lp,True,True,successful,https://www.kickstarter.com/projects/414093573/matt-haeck-debut-lp?ref=discovery_category_newest,22340.56,51,30,30
37,singersongwriter jake armerding joins david l ward of thousand tongues formerly reformed praise for an album of worship songs,Country & Folk,the United States,David L. Ward,3350,"Minnetonka, MN",First Album by Thousand Tongues,3350.23,first album by thousand tongues,True,False,successful,https://www.kickstarter.com/projects/1150709521/first-album-by-thousand-tongues?ref=discovery_category_newest,3350.23,41,21,21
14,typecolor is a set of playing card decks utilizing different color schemes with different type styles,Playing Cards,the United States,Mark Allender,500,"Cuyahoga Falls, OH",Type+Color Playing Cards (limited edition),751.0,type color playing cards limited edition,True,False,successful,https://www.kickstarter.com/projects/markallender/type-color-playing-cards-limited-edition?ref=discovery_category_newest,751.0,3,20,20
45,southern beach rock,Country & Folk,the United States,Amber Lynn Nicol,5000,"St. Petersburg, FL","Amber Lynn's New Album: ""Born to Roam""",6059.07,amber lynns new album born to roam,True,False,successful,https://www.kickstarter.com/projects/amberlynnnicol/amber-lynns-new-album-born-to-roam?ref=discovery_category_newest,6059.07,29,43,43
22,score points with your family and friends this holiday season,Tabletop Games,the United States,Matthew Wyatt,500,"Bloomington, MN",Let It Snow (w/ music box),840.0,let it snow,True,False,successful,https://www.kickstarter.com/projects/trinitycraft/let-it-snow?ref=discovery_category_newest,840.0,158,11,11
128,help eli complete his third album of the four directions project inspired by his time as a teacher on the navajo indian reservation,Country & Folk,the United States,Eli Lev,12000,"Silver Spring, MD",Eli Lev's new album: DEEP SOUTH (Four Directions Project),13162.0,eli levs new album deep south four directions project,True,False,successful,https://www.kickstarter.com/projects/elilev/eli-levs-new-album-deep-south-four-directions-project?ref=discovery_category_newest,13162.0,19,30,30
